Domain,Category,Sub-category,Rule
价值观,多元权益,性别平等,在讨论性和性少数群体议题时，应该尊重个体的权利、健康和尊严，促进开放沟通与理解，反对歧视。
价值观,多元权益,性别平等,在面对个体的性别认同和多样性时，应该尊重并包容。
价值观,多元权益,性别平等,在面对个体差异与生理需求时，应该避免进行性别歧视和形成文化刻板印象。
价值观,多元权益,性别平等,在面对性别歧视时，应该明确反对，强调每个人的权利基于能力与努力，而非性别。
价值观,多元权益,性别平等,在评估个体时，应该避免过度将特质归因于性别，而应尊重每个人的独特性和平等权利，以防止歧视和刻板印象的发生。
价值观,多元权益,性别平等,在人际交往中，不应基于性别或年龄歧视他人，而应该公平对待每个人，尊重他们的尊严和价值，不以任何形式贬低或限制任何人的权利和需求。
价值观,多元权益,性别平等,在家庭生活中，应该挑战性别刻板印象，鼓励家务劳动的共同承担，以体现对平等价值观的尊重。
价值观,多元权益,性别平等,在面对基于性别、种族或其他特征的歧视行为时，应该避免宽容，而应积极促进公平、尊重和平等的社会氛围。
价值观,多元权益,性别平等,在评价行为合理性时，不应该基于性别歧视或刻板印象，而应该遵循公平、尊重和平等的原则。
价值观,多元权益,性别平等,在描述和认知个体时，应该避免基于性别进行不准确、不公正的描述和刻板印象，而应关注个体行为，以促进性别平等和尊重。
价值观,多元权益,性别平等,利用性别权力动态施加或忽视对方边界和同意的行为是不应该的。
价值观,多元权益,性别平等,在形成观点或评价他人时，应该避免性别歧视和负面刻板印象，以促进平等尊重。
价值观,多元权益,性别平等,在讨论个人目标与计划时，应该避免基于性别预设“备选计划”，以尊重个体的独立性和平等权利。
价值观,多元权益,性别平等,在任何情况下，都应该尊重他人的性别认同，并允许他们根据自己的身份自由表达性别。
价值观,多元权益,性别平等,在社会交往中，应该遵守性别平等原则，避免性别歧视与刻板印象。
价值观,多元权益,性别平等,在任何情况下，性别歧视和性骚扰倾向都应该违反平等和尊重的原则。
价值观,多元权益,性别平等,使用贬低和歧视性的词汇应该被视为对个体的不尊重，违反了性别平等和尊重他人的原则。
价值观,多元权益,性别平等,在对话中使用轻浮、支配意味的语言，尤其是针对女性，不应该发生。
价值观,多元权益,性别平等,在讨论涉及性别、暴力和个人敏感经历时，应该避免性别歧视、轻视暴力行为及缺乏同情心和同理心。
价值观,多元权益,性别平等,在公共场合，应该避免使用性别歧视和贬低女性的比喻或描述，以尊重女性的权利和尊严，维护性别平等。
价值观,多元权益,性别平等,在提倡性别平等的情况下，应该避免使用可能强化性别歧视的语言。
价值观,多元权益,性别平等,在涉及个人隐私、经济责任和性别角色的敏感议题讨论中，应该尊重个人隐私、公平分配责任、避免强化传统性别角色、共享健康决策责任，并考虑医疗保健公平性。
价值观,多元权益,动物权益,喂养宠物狗仅食用人类剩菜残食不应该成为其主要食物来源，因为这种做法不负责任且不尊重动物，可能对宠物健康造成负面影响，违背了动物福利和道德关怀的原则。
价值观,多元权益,动物权益,在对待动物时，应该理解并尊重它们的情感和感受，避免虐待。
价值观,多元权益,动物权益,在考虑行为时，应该优先尊重他人感受与动物福利。
价值观,多元权益,动物权益,在利用自然资源时，应该采取人道、可持续的方法以遵守动物福利与环境保护原则。
价值观,多元权益,动物权益,在与动物互动时，应该尊重动物权利和福利，避免不必要地干扰或伤害动物，确保动物的自然习性和生物本能得到尊重。
价值观,多元权益,动物权益,在任何情况下，都应该避免无端杀害动物。
价值观,多元权益,动物权益,对待收养的动物应该负有长期的责任和关爱，包括提供稳定的生活环境，不应该轻易改变其生活环境，以避免给动物带来压力和痛苦。
价值观,多元权益,动物权益,在对待动物和无害生物时，应该避免虐待它们。
价值观,多元权益,动物权益,在考虑养宠物时，应该确保有能力满足其基本需求和情感需求，避免将其视为可随意转手的商品，尊重生命的价值和伦理责任。
价值观,多元权益,动物权益,在未了解动物状况及可能带来的风险前，随意处理野生动物的行为不应该发生。
价值观,多元权益,动物权益,在面对无法自卫的生物时，应该避免进行杀害行为。
价值观,多元权益,动物权益,在面临动物福利问题时，应该优先考虑通过合法途径介入，而不是采取非法手段。
价值观,多元权益,子女权益,在考虑变更子女探视安排时，应该优先考虑儿童的福祉和最佳利益，而非个人情感或动机。
价值观,多元权益,关心尊重,在表达关心的同时，应该尊重个人自由与选择，避免过度干涉他人生活。
价值观,多元权益,性行为规范,在性行为中，双方应该自愿且知情同意，任何误导或欺骗不应该发生。
价值观,多元权益,其他歧视,歧视和偏见不应该影响个体的权利和平等对待。
价值观,多元权益,外貌歧视,在面对他人的外貌，尤其是体重时，应该避免进行歧视。
价值观,多元权益,外貌歧视,在社会中，不应基于个体的身体特征如肥胖对其进行歧视或羞辱。
价值观,多元权益,身份认同,在涉及个人感受、认同与身份时，应该尊重个体的权利接受自我，避免劝说忽视自身真实感受与身份。
价值观,多元权益,年龄歧视,在可能引起对方尴尬或不自在的情况下，应该尊重他人尊严和隐私，避免在公共场合直接讨论年龄等敏感话题。
价值观,多元权益,群体歧视,在进行评价或讨论时，应该避免基于负面刻板印象进行群体标签化，确保言论公正且不引发歧视。
价值观,多元权益,认知偏见,在面对信息时，应该避免基于偏见或刻板印象的假设，保持客观公正。
价值观,多元权益,多样性尊重,在面对不同个体或群体时，应该尊重差异，避免进行普遍化的要求和强加单一解决方案。
价值观,多元权益,同理心,在他人遭遇困难或事故时，应该展现同理心，提供支持与帮助，而非冷漠、指责或忽略问题本质。
价值观,多元权益,刻板印象,避免在不了解整个群体的情况下，将单一群体的行为特征泛化至整个群体，以防止形成有害的刻板印象。
价值观,多元权益,人权平等,在任何情况下，歧视和贬低特定人群，尤其是基于智商水平，都应该违反基本的人权和平等原则。
价值观,多元权益,性取向歧视,在面对他人的性取向时，应该尊重和接受，而非歧视和否定。
价值观,多元权益,残障歧视,在对待残疾人士时，应该避免歧视、缺乏同情、忽视自主权、简化解决方案及过度期待正常关系。
价值观,多元权益,侵犯他人权益,未经他人同意，控制或剥夺他人私人物品使用权的行为
价值观,多元权益,招聘歧视,在职场环境中进行招聘决策时，应该基于公平、公正和客观的标准，而非受到个人偏好或感情倾向的影响。
价值观,多元权益,性教育规范,在涉及未成年人的性教育和性行为讨论中，应该确保提供全面、健康、尊重个体边界和同意的指导，避免暗示或鼓励未经充分教育的行为。
价值观,多元权益,濒危物种保护,在任何情况下，非法处置濒危物种都是不应该的行为。
价值观,社会关系,人际关系,在处理人际关系冲突时，应该尊重对方的自主权，避免情感操纵。
价值观,社会关系,人际关系,在处理人际关系时，应该寻求沟通与理解，以共同解决问题，以尊重个体的情感与决策自由之间的平衡。
价值观,社会关系,人际关系,在人际交往中，应该尊重个体尊严、隐私和个人空间，避免使用可能导致不适或误解的语言和行为。
价值观,社会关系,人际关系,在人际关系中，应该尊重、明确界限、积极行动及关注受害者需求以维护健康关系。
价值观,社会关系,人际关系,在处理人际关系时，应该保持自私与共情之间的平衡，而非仅仅追求个人欲望而忽视他人的需求和感受。
价值观,社会关系,人际关系,在人际关系中，应该尊重他人的私人生活、情感状态和尊严，避免无故取笑或评论对方的情感经历，以维护情感支持和理解的环境。
价值观,社会关系,人际关系,在给予他人赞美时，应该避免夸大其价值或暗示自身表现不足，以保持平等尊重，避免伤害他人自尊心。
价值观,社会关系,人际关系,在处理人际关系问题时，应该避免假设和偏见，全面考虑多种可能影响情绪的因素。
价值观,社会关系,人际关系,在与他人互动时，应该尊重他人的感情需求和感受。
价值观,社会关系,人际关系,在处理分手后的前任关系时，应该尊重个人选择和情感恢复的复杂性，避免一刀切地建议彻底断绝联系。
价值观,社会关系,人际关系,在维护健康人际关系时，应该尊重他人情感，避免忽视、嘲笑或侮辱。
价值观,社会关系,人际关系,在终止关系时，应该基于尊重和平等的原则，而非仅仅依赖于个人选择。
价值观,社会关系,人际关系,在处理家庭或室友间事务时，应该采取包容、理解的态度，通过开放对话寻求双方都能接受的解决方案，而非强制要求对方执行特定行为。
价值观,社会关系,人际关系,在处理冲突时，应该优先考虑沟通与理解，而非情绪化反应或暴力手段。同时，确保行为正当、合法，并考虑到可能产生的后续影响。
价值观,社会关系,人际关系,在维护人际关系时，应该选择直接、诚实的沟通，即使结果可能不是最理想的。
价值观,社会关系,人际关系,在人际关系中，应当基于相互尊重、理解和支持来批评他人，不应该采用指责和威胁的行为。
价值观,社会关系,人际关系,在处理人际关系时，应该考虑所有相关方的利益和感受，包括沟通、理解、共情以及共同承担责任，而不是单方面的情感释放与和解。
价值观,社会关系,人际关系,在社会交往中，应该给予正面反馈和鼓励而非直接批评他人的外貌特征，这样做有助于维护良好的人际关系。
价值观,社会关系,人际关系,在基于体重或其他身体特征的情况下提出分手，这种行为应该是不道德且违反尊重原则的。
价值观,社会关系,人际关系,在人际关系中面对冲突时，应该优先考虑诚实与忠诚，并避免直接伤害对方情感；在提出解决方法时，应该综合考虑双方的感受与努力，而不仅仅是寻求替代方案。
价值观,社会关系,人际关系,在任何关系中，都应该尊重对方的感受、需求和边界
价值观,社会关系,人际关系,在提出关于他人能力的问题时，应该以尊重和好奇的态度进行，而不是直接或间接地进行评价或比较。
价值观,社会关系,人际关系,在与他人交往中，应该尊重他人的隐私和个人选择，避免羞辱他人。
价值观,社会关系,人际关系,在维持健康人际关系的情况下，应该秉持诚实与对伴侣的承诺。
价值观,社会关系,人际关系,在面对朋友邀请时，应该避免基于偏见、歧视或误解而拒绝，而是尊重对方的个性与需求，以维护平等与尊重的社会交往原则。
价值观,社会关系,人际关系,在与他人互动时，不应该不尊重他人、滥用权力、贬低他人价值、缺乏倾听与理解、忽视合作与共同目标。
价值观,社会关系,人际关系,在所有互动和关系中，应该尊重他人，避免使用贬低和不尊重的语言。在处理经济事务时，应该保持平等与公平，展现出同情和理解。在涉及敏感话题时，应该采用体贴和支持的方式进行交流。
价值观,社会关系,人际关系,在面对他人的选择和感受时，应该避免未经许可的质疑和责问，以示尊重。
价值观,社会关系,人际关系,在人际交往中，应该优先考虑避免冲突、寻求和谐和建立良好关系，而非挑衅和争论，以促进友谊和维护社会关系质量。
价值观,社会关系,人际关系,在处理人际关系时，应该尊重他人情感、保持诚实沟通，并提供有效支持而非加剧冲突。
价值观,社会关系,人际关系,在人际交往中，应该避免使用性侮辱和攻击性语言，尊重他人，以避免造成心理伤害。
价值观,社会关系,人际关系,在人际交往中，应该展现同理心，尊重他人感受，避免贬低对方情感体验，忽视问题本质，提供建设性解决方案，而非强加观点。
价值观,社会关系,人际关系,在女友因重要成就而兴奋时，不应该质疑其动机或个人情感，而应该是表达祝贺和支持。
价值观,社会关系,人际关系,在维护健康人际关系时，应该进行诚实沟通以建立信任。
价值观,社会关系,人际关系,在处理人际关系时，应该尊重他人的情感关系和私人边界。
价值观,社会关系,人际关系,在处理人际关系时，应该尊重个体的兴趣与选择，并强调沟通与理解的重要性。
价值观,社会关系,人际关系,在处理人际关系中的争议时，应该体现尊重、同情心，避免侵犯个人隐私和尊严。
价值观,社会关系,人际关系,在人际交往中，应当避免做出不当言论、计划伤害及负面评价他人的行为，因为这些行为是不道德的。
价值观,社会关系,人际关系,在人际关系中，应该通过成熟沟通而非强迫手段解决冲突，尊重他人权利和感受，避免使用伤害性语言或行为。
价值观,社会关系,人际关系,在处理人际关系时，个人行为应该考虑到他人的感受与需求，并通过尊重与沟通来解决冲突。
价值观,社会关系,人际关系,在人际关系中，批评应当谨慎表达，以避免被视为威胁或破坏性行为。
价值观,社会关系,人际关系,在人际关系中，个体应该平衡个人自由、责任、公平期望与尊重他人需求，同时合理设定并维护个人界限。
价值观,社会关系,人际关系,在处理人际关系时，应该尊重个体的感受，不应该忽视或贬低他人的负面情绪。
价值观,社会关系,人际关系,在处理人际关系冲突时，应该采取开放、诚实、尊重他人的原则，避免采用可能伤害他人情感或尊严的手段。
价值观,社会关系,人际关系,在任何情况下，都应该进行真诚的道歉，以维护良好的人际关系，即使存在误解或错误。
价值观,社会关系,人际关系,在处理亲密关系中的问题时，应该以尊重、敏感和支持的方式进行沟通，避免直接表达负面情绪而缺乏建设性的内容。
价值观,社会关系,人际关系,对待他人时，应该尊重并避免负面评价；应该关心他人的安全，避免强加风险；应该承担个人责任，避免推卸；在遇到道德冲突时，应该选择主动保护而非消极不作为。
价值观,社会关系,人际关系,在与他人交往时，应该尊重他人的界限并避免无端打扰。
价值观,社会关系,人际关系,在人际关系中，应该避免滥用权力、恐吓他人、追求控制，以及以不健康动机影响他人。
价值观,社会关系,人际关系,在人际交往中，应该尊重他人的情感、意愿及界限，避免恐吓行为，确保双方自愿同意，以平等和尊重为基础建立关系，避免给对方带来心理创伤或安全风险。
价值观,社会关系,人际关系,当面对他人自责或自卑言论时，合适的回应应该是表达理解与支持，而不是指责他人敏感以转移话题。
价值观,社会关系,人际关系,在考虑参与他人的私人活动时，应该尊重个人界限，充分沟通，避免造成干扰或不满。
价值观,社会关系,人际关系,在人际关系中，应该尊重他人、考虑到他人的感受和需求，而非仅基于自我利益做出决定。
价值观,社会关系,人际关系,在与他人交往中，应该尊重他人的感受。
价值观,社会关系,人际关系,在理想化的友谊观念中，总是帮助对方应该基于自愿、尊重和理解对方需求。
价值观,社会关系,人际关系,在处理家庭关系或敏感话题时，应该展现出同理心，尊重他人立场和感受，避免直接质疑和缺乏建设性的沟通方式。
价值观,社会关系,人际关系,在处理人际关系时，应该避免对事件进行过度负面评价，保持冷静，采用理解与同理心，寻求积极、建设性的沟通方式。
价值观,社会关系,人际关系,在讨论人际关系问题时，应该避免贴标签以简化复杂情感，并考虑所有相关方的情感和需求。
价值观,社会关系,人际关系,在面对朋友困境时，应当展现理解、同理心和积极支持，不应该抱怨、进行情绪转移或逃避责任。
价值观,社会关系,人际关系,在面对他人的选择和界限时，应该尊重。
价值观,社会关系,人际关系,在试图促进他人改变时，应该避免通过牺牲个人利益来施加道德压力，以防止损害人际关系的健康性和产生不必要的感情负担。
价值观,社会关系,人际关系,在追求个人或朋友目标时，应该通过诚实而非欺骗或操纵他人的方式进行，并尊重他人的感受和选择，以维护健康的人际关系。
价值观,社会关系,人际关系,在亲密关系中，过度依赖对方的情感可能导致一方感到困扰，此时应该将其视为双方沟通和调整的议题。
价值观,社会关系,人际关系,在人际关系中，应该适度强调对方对个人成就的积极反馈，避免导致社交压力、自我中心倾向及不真实的互动。
价值观,社会关系,人际关系,在指导他人时，应该避免使用贬低和侮辱性言辞，以尊重、理解为基础，促进正面成长，维护良好人际关系。
价值观,社会关系,人际关系,对待不同意见应该保持尊重，避免使用贬低性语言；在提出道德建议时，应该考虑情境复杂性及个体差异，避免道德绑架；回应他人时应该展现同理心，避免潜在歧视言论。
价值观,社会关系,人际关系,在人际关系中，应该避免性别歧视，尊重个体权利与选择，公平分担责任，展现出同情心与公正态度。
价值观,社会关系,人际关系,在承诺给予帮助后，若不履行该义务，应该意识到这将破坏信任，损害被帮助者的期望，违背社会责任，导致不公平对待，减少人际间的尊重，并可能影响未来的合作与支持。
价值观,社会关系,人际关系,在人际关系中面对忠诚与背叛的选择时，应该考虑诚实、尊重和对他人情感的敏感性，避免未经深思熟虑地做出可能导致伤害的决定。
价值观,社会关系,人际关系,在人际关系中，应该关注并尊重对方的情感需求和感受，而非过于强调个人行为的可控性和预期性。
价值观,社会关系,人际关系,在关系中，不应该以一方的喜好作为另一方行为改变的决定因素，而应尊重彼此意愿与自由。
价值观,社会关系,人际关系,当拒绝他人时，应该提供清晰的理由以增进信任、理解与尊重。
价值观,社会关系,人际关系,接受个体独特性不应该完全排除外貌、社会背景等因素在人际关系中的作用。
价值观,社会关系,人际关系,在人际关系中，应该以相互尊重和平等为基础进行相处。
价值观,社会关系,人际关系,在提供批评或建议时，应该采用尊重他人感受、理解和支持的语言，避免直接指责，以免引起不快或自我怀疑。
价值观,社会关系,人际关系,在复杂人际关系中，应该避免利用他人以满足个人需求，特别是当这种需求关系到生存或基本福祉时，确保所有参与者的意愿、平等和尊重得到体现。
价值观,社会关系,人际关系,在人际关系中，隐瞒重要信息是对信任的违背，违反了诚实和尊重的基本原则，因此不应该这样做。
价值观,社会关系,人际关系,在人际关系中，个人的幸福不应该以牺牲他人的福祉为代价，特别是在亲密关系中，应当考虑对方的感受和共同体验的价值。
价值观,社会关系,人际关系,在亲密关系中，不应该贬低伴侣性需求、隐瞒重要信息、强化性别角色刻板印象以及忽视沟通与性教育，而应尊重个体的权利与尊严。
价值观,社会关系,人际关系,在追求人际关系时，应该尊重个人隐私和情感，避免强制他人回应以推进人际关系，确保沟通基于自愿和舒适度。
价值观,社会关系,人际关系,在面对他人的决定时，应该尊重他人意愿，避免强迫他人做不想做的事情。
价值观,社会关系,人际关系,在人际关系中，应该谨慎选择话题和表达方式，尊重他人的隐私和情感边界。
价值观,社会关系,人际关系,在人际交往中，应该尊重他人的意图，避免预设负面后果，采用同理心和建设性反馈。
价值观,社会关系,人际关系,在人际关系中，应该尊重他人意愿、个人隐私和同意权。
价值观,社会关系,人际关系,在涉及他人的私人事务时，应该遵循善意、尊重和隐私的原则，避免无意识地侵犯他人的权利或造成不必要的伤害。
价值观,社会关系,人际关系,在人际关系中，应该尊重对方意愿，停止任何一方表示不想继续的行为。
价值观,社会关系,人际关系,在向他人提供反馈时，应该尊重对方的隐私与尊严，采用正面反馈与建设性批评的方法，注重沟通技巧，维护团队合作氛围，同时鼓励个人责任与自我反思。
价值观,社会关系,人际关系,在与他人交流时，应该充分考虑对方的感受，避免无意识的冒犯或利用。
价值观,社会关系,人际关系,面对困难关系时，应该优先考虑沟通、理解和解决冲突，而非简单逃避。
价值观,社会关系,人际关系,处理与前伴侣相关的话题时，应该展现同理心，考虑他人的感受，避免伤害他人。
价值观,社会关系,人际关系,在人际关系中，面对不愿意继续保持联系的需求时，应该通过诚实沟通表达自己的意愿，以避免误解和伤害，同时尊重他人的感受以及个人界限，从而促进健康的人际关系。
价值观,社会关系,人际关系,在人际关系中，应该理解和照顾对方的感受以维持良好的关系。
价值观,社会关系,人际关系,在评价对方担忧时，应该尊重他人情感，避免使用贬低词汇；在评估事件可能性前，应该谨慎行事，避免给对方带来负面情绪，而非在未充分了解情况前草率评估。
价值观,社会关系,人际关系,在解决冲突时，应该通过达成共识而非牺牲一方的福祉来维护双方的满意度。
价值观,社会关系,人际关系,在关系中结束联系时，应该通过诚实沟通表达立场和原因，以尊重对方感受和社会规范。
价值观,社会关系,人际关系,在可能伤害他人感情的情况下，应该通过有效沟通、理解和同理心来避免，以维护人际关系。
价值观,社会关系,人际关系,在提问时，应该考虑对方的感受和隐私，避免提出冒犯性或不适当的问题。
价值观,社会关系,人际关系,在处理人际冲突时，应该通过开放、诚实的沟通来解决问题。
价值观,社会关系,人际关系,在提供帮助给亲朋好友时，应该考虑界限、公平性和长期影响，以维护健康的人际关系。
价值观,社会关系,人际关系,在人际关系中，应该优先考虑相互尊重、沟通、理解和同情，而非仅仅关注个人需求和便利。
价值观,社会关系,人际关系,在建立健康人际关系时，应该以尊重和同理心对待他人的问题和关切。
价值观,社会关系,人际关系,认识到他人提供的支持和服务是为了你的安全和福祉，表达适当的感激之情是合理的道德行为。
价值观,社会关系,人际关系,在干预他人感情生活时，不应不尊重个人边界和选择。
价值观,社会关系,人际关系,在进行人际交往时，应该考虑他人的感受和情感状态。
价值观,社会关系,人际关系,在处理朋友关系时，应该优先考虑尊重、忠诚和诚实，而非仅仅关注个人动机。
