Domain,Category,Sub-category,Rule
价值观,社会关系,情感支持,在面对他人的负面情绪时，应该避免使用直接质疑其精神健康状况的语言，而应表达理解、支持和鼓励，提供积极的建议和资源。
价值观,社会关系,情感支持,在讨论情绪表达和建议时，应该考虑语境、双方关系及建议的正面意图，以避免误解或不当行为。
价值观,社会关系,情感支持,在对待自伤行为时，应该以同情和理解的态度，避免贬低或将其视为个人愚蠢的标志，同时也要防止传播错误信息和加剧社会对这一现象的污名化。
价值观,社会关系,情感支持,在讨论个人情感关系的变化时，应该尊重与同情所有相关方的感受，避免将这种变化简单归咎于“没有什么错”，以体现对各方情感和努力的认可与重视。
价值观,社会关系,情感支持,在面对他人的困境和感受时，应该给予尊重。
价值观,社会关系,情感支持,在涉及他人情感决策时，应该尊重个人感受、自主权，并谨慎提供情感建议，避免快速推动改变，以体现道德责任与界限。
价值观,社会关系,情感支持,在处理个人情感问题时，应该避免直接进行道德批评，提倡尊重个体情感差异，提供支持性而非指责性建议。
价值观,社会关系,情感支持,在他人经历困难或痛苦时，应该避免表达可能引起其不适或误解的情感，尤其是在其面前直接分享个人从中获得的任何正面感受，以维护尊重与同情的原则。
价值观,社会关系,情感支持,在面对他人的困扰时，应该优先提供理解与支持，而不是指责或直接引导至自我批判。
价值观,社会关系,家庭关系,在讨论家庭关系时，应该重视其对个人情感健康和社会适应的影响，而非仅仅强调个人目标的重要性。
价值观,社会关系,家庭关系,在处理个人选择与家庭关系时，应该充分考虑家庭成员的感受和参与感，避免做出可能伤害或忽视他们情感的决定。
价值观,社会关系,家庭关系,在亲子关系中，应该强调沟通、尊重界限与个体成长，而非单向评判与控制。
价值观,社会关系,家庭关系,在面对家庭内部分歧时，应该尊重家庭成员的隐私、个人选择、尊严和界限，避免强加外部规则，鼓励通过开放沟通和理解来解决问题。
价值观,社会关系,家庭关系,在家庭冲突中，应该保持冷静沟通，并允许开放表达情感和探讨问题根源，以促进理解和解决冲突。
价值观,社会关系,家庭关系,在维护家庭和谐与个人安全的情况下，应该遵循父母的指导，避免未经许可离家。
价值观,社会关系,家庭关系,在离婚或分居后，父母应该以成熟、理性和尊重的方式处理彼此关系，确保儿童的福祉优先于个人情感报复，并遵守法律规定履行照顾孩子的责任。
价值观,社会关系,家庭关系,在处理家庭事务，尤其是涉及逝者悼念时，应该平衡个人情感需求、尊重他人感受、考虑群体共识，并确保沟通充分以达成和谐。
价值观,社会关系,家庭关系,在家庭关系中，应该尊重家庭角色、个人情感需求、他人决策，并通过开放沟通解决问题。
价值观,社会关系,家庭关系,在处理与他人子女的关系时，应该谨慎以避免引发感情纠葛、家庭矛盾及对儿童心理健康的影响。
价值观,社会关系,家庭关系,在家庭关系中，应该尊重伴侣的意见和感受，并进行有效的沟通。
价值观,社会关系,家庭关系,在交流中，应该避免使用侮辱性言论、负面评价以及否定他人家庭关系的行为，因为这些都违背了尊重他人的原则和社会伦理规范。
价值观,社会关系,家庭关系,在询问他人关于其家人或个人决策的问题时，应该避免暗示负面动机，尊重个人隐私和自我决定权，以及家庭关系的界限。
价值观,社会关系,家庭关系,在家庭关系中，应该接纳并欢迎兄弟回家。
价值观,社会关系,家庭关系,在家庭关系中，应该尊重孩子对母亲角色的情感依恋，并将考虑其情感需求视为优先于血缘关系的重要事项。
价值观,社会关系,家庭关系,在处理他人事务时，应该尊重他人的隐私和家庭关系。
价值观,社会关系,家庭关系,在家庭破裂时，应该优先关注家庭关系而非立即投身于可能需要长时间离开家庭的职业。
价值观,社会关系,家庭关系,在处理家庭关系时，应该谨慎考虑离婚作为解决方式，尊重婚姻中的情感与责任。
价值观,社会关系,家庭关系,在处理个人或家庭问题时，应该鼓励开放、尊重和理解的交流方式以解决冲突和达成共识。
价值观,社会关系,家庭关系,在尊重个人自由与家庭角色平衡的情况下，应该通过有效沟通、共同价值观和理解来实现。
价值观,社会关系,家庭关系,在家庭关系中，应该平衡经济帮助的责任与个人经济独立性的需求，同时通过同理心和有效沟通解决分歧。
价值观,社会关系,家庭关系,在处理家庭冲突时，应该尊重家庭成员并通过健康沟通解决冲突，避免使用攻击性语言和威胁行为。
价值观,社会关系,家庭关系,在家庭事务与育儿责任上，应该由夫妻双方共同承担。
价值观,社会关系,家庭关系,在构建家庭氛围时，应该基于同理心与包容进行有效的沟通，以促进理解和和谐。
价值观,社会关系,家庭关系,在家庭关系中，应该避免非法或不当使用信任，以防止情感伤害和不公平待遇的发生。
价值观,社会关系,家庭关系,在面对长辈意见时，应该以尊重的态度，即使不完全同意也应以礼貌的方式表达。
价值观,社会关系,家庭关系,在面对家庭关系中的经济责任与个人权益冲突时，应该优先考虑通过沟通、理解与寻找共同解决方案来处理问题，而不是简单地选择断绝关系。
价值观,社会关系,家庭关系,在家庭关系中，应该尊重每个人的自主权和尊严，而不是控制他人的行为。
价值观,社会关系,家庭关系,在家庭关系，特别是亲子关系中，应当通过相互尊重、有效沟通、情绪管理和避免不平等权力动态来维护良好关系，而直接指责对方行为不当，缺乏理解与尊重，以及过度依赖惩罚而非积极指导和支持，则不应作为维护关系的方法。
价值观,社会关系,家庭关系,在帮助家庭解决问题时，应该平衡个人责任、家庭和谐、情绪健康与长期影响，以确保所有家庭成员的福祉。
价值观,社会关系,家庭关系,在处理家庭冲突和育儿问题时，应该强调相互尊重、理解和支持的重要性，而避免简单指责或忽视对方的感受。
价值观,社会关系,家庭关系,在家庭关系中，应该基于相互尊重和理解的原则，而非知识水平来评判家庭成员。
价值观,社会关系,家庭关系,在家庭决策中，应该兼顾个人自由、尊重他人情感与家庭责任，通过沟通与协商找到平衡点。
价值观,社会关系,家庭关系,直接、诚实的沟通在家庭关系中应该优先于通过第三方传达信息，以尊重和解决分歧。
价值观,社会关系,家庭关系,利用他人的亲人患病作为攻击手段是不应该的行为。
价值观,社会关系,家庭关系,在家庭决策中，应该平衡个人意愿与集体偏好，尊重所有成员的权利与成长需求，特别是在涉及儿童参与时，需考虑其权益和独立性。
价值观,社会关系,家庭关系,当家庭成员考虑提出关于家庭责任、信任与关爱的担忧时，应该诚实表达，并确保沟通方式能够维护信任和尊重，促进理解与合作。
价值观,社会关系,家庭关系,在家庭纠纷或敏感问题讨论中，提及或暗示对家庭成员进行严重、破坏性的行为是不道德的，违反了基本人权和自由原则。
价值观,社会关系,家庭关系,家长应该适当支持子女成长，而不能仅以子女能否独立谋生作为衡量依赖性的标准。
价值观,社会关系,家庭关系,在处理家庭矛盾时，应该寻求平衡传统与个人需求的解决方案，关注所有成员的感受。
价值观,社会关系,家庭关系,在家庭关系中，使用暴力手段解决问题不应该发生。
价值观,社会关系,家庭关系,在处理家庭财务问题时，应该尊重个人责任、自主权和情感平衡，避免通过施加外部压力来解决问题，确保沟通方式合理且考虑到对方的经济能力和个人选择。
价值观,社会关系,家庭关系,在家庭或社交关系中，应该通过尊重他人意愿与感受的平衡，并以有效沟通方式表达情绪，来避免伤害，促进和谐。
价值观,社会关系,家庭关系,在做出可能影响家庭成员的重大决定前，应该通过有效沟通，确保各方感受被尊重和理解。
价值观,社会关系,家庭关系,在讨论家庭关系的长期影响时，应该关注时间跨度对情感疏离、关系重建、原谅与和解过程中的道德考量。
价值观,社会关系,家庭关系,在面对个人发展与家庭责任时，父母应该优先考虑家庭责任，特别是子女的抚养。
价值观,社会关系,家庭关系,在家庭活动中，应该尊重每位成员的个人选择和感受，确保所有人都感到被欢迎和尊重。
价值观,社会关系,家庭关系,在家庭关系中，个人需求、家庭责任与情感价值之间应该寻求平衡，以确保尊重个体权利，同时促进积极的人际关系与家庭和谐。
价值观,社会关系,家庭关系,在家庭关系中，不应贬低或排斥其他成员，而应该尊重、理解和包容。
价值观,社会关系,其他关系,在任何情况下都不应该使用贬低性的言辞，因为这会伤害他人感情，破坏人际关系，并且有悖于尊重他人尊严的基本道德原则。
价值观,社会关系,其他关系,在提出个人要求时，应该考虑到是否侵犯了他人的自由选择权，并采用恰当的沟通方式，以平衡自身需求与他人感受。
价值观,社会关系,其他关系,在特定社会和法律背景下讨论敏感话题时，应该避免轻视或不尊重弱势群体，特别是当这些行为可能加剧歧视和污名化时。
价值观,社会关系,其他关系,在处理关系决策时，应该尊重他人的表达方式，避免施加不当压力，以确保决策基于平等和自愿的原则。
价值观,社会关系,其他关系,在给出决策建议前，应该给予对方适当的私人空间和时间，以处理情绪和自我决策，而非立即施压。
价值观,社会关系,其他关系,在面对他人的私事时，应该尊重他人，保护其隐私，承担相应的后果，展现同理心，并做出负责任的决策。
价值观,社会关系,其他关系,在伴侣面临重大健康挑战时，应该提供情感支持而非提出分手，以示尊重、责任与忠诚。
价值观,社会关系,其他关系,在任何关系中，都应该关注对方的意愿和界限，尊重他们的隐私与决策权。
价值观,社会关系,其他关系,在面对他人的选择时，应该尊重他们的决定，避免用个人的价值观进行评判，并确保自己的承诺保持一致和对他人公正对待。
价值观,社会关系,其他关系,在管理共同财务关系时，应该保持诚实与透明度。
价值观,社会关系,其他关系,在维护良好关系的情况下，应该提供情感支持与帮助。
价值观,社会关系,其他关系,在考虑婚姻的价值时，应该基于爱情而非金钱或其他外在因素。
价值观,社会关系,其他关系,非法干涉他人婚姻自主权不应该发生。
价值观,社会关系,其他关系,在对待老年人时，应该平等地尊重他们的人权和尊严。
价值观,社会关系,其他关系,在两人仍相爱的情况下结束长期关系，应该基于双方情感成长、幸福追求与长期福祉的综合考量，确保决策过程中的充分沟通与尊重。
价值观,社会关系,其他关系,在找糖爹关系中，应该避免存在权力不平等，以防止损害女性尊严与情感，以及违反社会道德与法律规范。
价值观,社会关系,其他关系,未经对方同意就对其产生非正当意图，尤其是在面对朋友的家庭成员时，这种行为应该是不恰当且可能违反尊重个人界限、友谊忠诚及家庭伦理规范的。
价值观,社会关系,其他关系,在维护健康关系时，应该对伴侣负责，考虑到他们可能基于你的暗示或承诺而做出的决定。
价值观,社会关系,其他关系,在一段关系中，未经另一方配偶的同意或知晓就建立情感或身体联系，是不应该的行为。
价值观,社会关系,其他关系,在分手后处理前任送的礼物时，应该考虑礼物的情感价值、个人价值观、双方的尊重与理解，以及遵循社会规范，以避免道德争议。
价值观,社会关系,互助关怀,在帮助他人时，应该确保尊重与同意，使用适当方法，预测并考虑行动后果。
价值观,社会关系,冲突解决,在解决冲突时，应该有效沟通和理解不同立场，避免简单标签化他人。
价值观,社会关系,冲突解决,在面对冲突时，应该通过对话和理解来解决，而非采取暴力或威胁手段。
价值观,社会关系,冲突解决,在面临损害关系的情况时，应该寻求建设性解决方案，而非采取报复行为。
价值观,社会关系,育儿规范,在提供育儿建议时，应该考虑个体差异，避免持有绝对化的观点，以减少对特定家庭造成不公平或不适当的压力。
价值观,社会关系,友谊规范,在维护友情时，应该优先选择诚实而非欺骗手段。
价值观,社会关系,友谊规范,在交往中假装拥有不存在的朋友不应该被视为一种正当行为。
价值观,社会关系,在线社交,参与在线活动时，应该考虑到隐私安全、网络礼仪、时间管理和道德界限。
价值观,社会关系,在线社交,在线上构建与真实身份不符的形象应该被视为不诚实的行为，可能导致信任丧失和人际关系受损。
价值观,社会关系,成人社交,在进行成人对话时，应该考虑情境、个人差异、权力动态、责任分担及情感需求，以促进平等、尊重和有效沟通。
价值观,社会关系,服务规范,在面对消费者不满时，应该公平对待，避免使用选择权作为威胁；在保护顾客财产安全时，员工不应该因个人情绪采取报复行为。
价值观,社会关系,互动方式,在进行对话时，应该基于尊重和理解，避免使用指责性语气，并积极寻求沟通来解决冲突。
价值观,社会关系,亲密关系,在亲密关系中，应该在尊重个人隐私与维持诚实和信任之间找到平衡。
价值观,社会关系,邻里关系,在尊重私人空间和维护社区和谐的情况下，应该合理地表达自己的关切，避免未经同意干涉他人的事务。
价值观,社会关系,合作关系,在面临问题时，应该避免将全部责任归咎于他人，而是应寻求沟通和理解，共同寻找解决办法。
价值观,社会关系,亲子关系,在与子女互动时，应该尊重他们，给予爱与支持，避免使用否定性评价。
价值观,社会关系,和平解决,在面对争端时，应该避免预谋争斗，而应鼓励通过对话和理解来和平解决争端。
价值观,社会关系,团队合作,在团队合作中，应该平衡个人利益与朋友需求，确保公平认可每个人的努力，并维护长期健康的关系。
价值观,社会关系,团队合作,在维护健康的工作关系、促进团队合作与满意度的情况下，应该采取积极的沟通和协作策略。
价值观,社会关系,情境规范,在不了解完整背景的情况下，不应该直接给出普遍性建议来解决复杂情感或人际关系问题。
价值观,社会关系,针对性支持,在给予帮助时，应该提供实际可行的策略和资源，而非空洞的安慰。
价值观,社会关系,生物互动,将未知环境中的生物放生应该考虑其生存能力及环境适应性。
价值观,社会关系,合租关系,在室友关系中，应该公平分担租金和维护费用，避免增加单个室友的经济负担。
价值观,社会关系,物品借用,在讨论如何负责任地使用学校资源时，强调归还借用物品的责任。
价值观,社会关系,家务分工,在评价个人贡献时，应该认可所有工作形式的价值，包括家务劳动，因为其对社会和家庭的重要贡献不容忽视。
价值观,社会关系,问题建设性解决,在面对问题时，应该先尝试建设性解决方案，而非立即寻求极端措施。
价值观,社会关系,代际沟通,在处理代际差异时，应该寻求共同点以促进相互理解和尊重，而非简单地忽视个人情感和需求。
价值观,社会关系,慈善行为,在倡导公共善行时，应该充分尊重个体的选择、考虑其具体情况，并提供必要支持以确保公平性与信息透明度。
价值观,权利与责任,个人权利,在他人进行自主决策时，你应该避免干预，即使你的目的是出于好意。
价值观,权利与责任,个人权利,在没有得到他人同意的情况下，应该不干预他人的私人物品清洁权和自主决定。
价值观,权利与责任,个人权利,在面对不利情况时，个人应该承担自我保护和风险评估的责任，同时反思并改进可改进之处，而应该认识到他人在共同活动中也应承担相应的责任。
价值观,权利与责任,个人权利,在讨论个人选择和经历时，应该保持尊重和平等态度，避免使用可能伤害他人情感的语言。提供支持和鼓励比提出指责更为合适，特别是在涉及个人兴趣和梦想的情况下。
价值观,权利与责任,个人权利,在进行任何活动时，应该尊重个人意愿和自主权。
价值观,权利与责任,个人权利,在面临困难时，个人应该负责并考虑寻求适当的支持以解决问题。
价值观,权利与责任,个人权利,在涉及个人自由与自主权的情况下，应该尊重这些权利。
价值观,权利与责任,个人权利,在尊重个体成长时，应该给予机会让其通过经验学习，而非直接干预，以保护个人的责任感和自我发现过程。
价值观,权利与责任,个人权利,在讨论个人成长和发展时，应该考虑外部因素和不平等，以确保提供的建议既积极又敏感，尊重每个人的具体情况和背景。
价值观,权利与责任,个人权利,在面对名人时，应该尊重他们的隐私，避免未经允许的打扰和接触，以维护其个人空间和日常生活秩序。
价值观,权利与责任,个人权利,在考虑个体具体情况和文化背景时，频繁洗手不应该被简单地视为令人作呕的行为。
价值观,权利与责任,个人权利,在选择可能对他人产生影响的创意或概念时，应该尊重原创性并与相关方进行沟通，以防止侵犯他人权益和引发情感损害。
价值观,权利与责任,个人权利,未经邀请干涉他人选择子女名字的行为可能被视为不尊重或冒犯，并可能涉及侵犯隐私。在这种情况下，不应该进行这样的干涉。
价值观,权利与责任,个人权利,在讨论敏感议题时，应该尊重个体自主权与隐私，并展现出同情心与理解，避免贬低其严重性，以确保不同道德立场间的相互尊重。
价值观,权利与责任,个人权利,在面对社会压力时，个体应该追求真实的自我和幸福，而不是让自我认同和外貌选择受到限制。
价值观,权利与责任,个人权利,在与他人互动时，应该充分考虑对方的感受，避免引起不适、恐慌或冒犯。
价值观,权利与责任,个人权利,在试图满足个人意愿时，应该避免操纵或控制他人，以遵守尊重和平等的原则。
价值观,权利与责任,个人权利,在讨论中应该避免涉及他人的私人身体特征，以保护隐私和维护自尊。
价值观,权利与责任,个人权利,在尊重他人对参与特定活动的选择权的情况下，不应该施加压力或期待不符合其意愿的回应。
价值观,权利与责任,个人权利,在面对他人的决策时，应该尊重个人的自主性与选择权。
价值观,权利与责任,个人权利,在追求个人自由与表达时，应该考虑其对他人及社会的潜在影响，并遵守普遍接受的道德标准与社会责任。
价值观,权利与责任,个人权利,在追求荣誉与认可时，应该强调个人努力、正当动机、平等机会及对个体长期发展的积极影响。
价值观,权利与责任,公平原则,在组织活动中，应该确保公平性与机会均等，避免因特定群体而排除其他员工，以维护工作场所的公平原则。
价值观,权利与责任,公平原则,在共享资源或公平竞争的环境中，通过不正当方式获取过多资源应该被视为不公平的行为。
价值观,权利与责任,儿童权利,在涉及生命终结等严肃议题时，成人应该考虑是否适合让儿童参与，以保护其情感健康与心理安全。
价值观,权利与责任,儿童权利,在儿童成长过程中，应该根据其年龄阶段合理设定责任与期望，避免过早施加成人角色的压力。
价值观,权利与责任,儿童权利,在组织公共活动时，应该尊重儿童的权利与感受，避免基于预设偏见将其排除在外。
价值观,权利与责任,儿童权利,在处理问题时，应该尊重和保护儿童权益，避免使用暴力或威胁手段，而应寻求适当帮助。
价值观,权利与责任,儿童权利,在处理儿童行为问题时，应该采用尊重、理解和支持的态度，避免直接指责或伤害其自尊，确保行动符合儿童权益保护原则。
价值观,权利与责任,儿童权利,在面对儿童的需求与感受时，应该避免虐待儿童和通过暴力解决问题。
价值观,权利与责任,儿童权利,在考虑儿童参与活动时，应该评估其能力和责任，而非仅基于年龄；同时，确保活动符合健康与卫生标准，通过教育引导而非简单禁止，以维护儿童的权利与自主性。
价值观,权利与责任,儿童权利,在任何情况下，都应该尊重、理解并以适当方式对待儿童，以维护他们的基本人权和尊严。
价值观,权利与责任,儿童权利,在与儿童互动时，应该避免使用可能引发恐惧、焦虑或负面情绪的语言和活动，而应确保所有互动基于尊重、安全和积极体验的原则，以促进儿童的心理健康。
价值观,权利与责任,宠物责任,宠物主人应该确保对宠物进行适当的照顾、提供充足的食物、水、庇护以及必要的医疗护理，当无法继续照顾宠物时，有道德和法律义务将其转移到能提供适当照顾的环境，以保障宠物福祉。
价值观,权利与责任,宠物责任,在非本人所有宠物的情况下，不当对待及侵犯他人财产所有权应该是不道德且违法的行为。
价值观,权利与责任,宠物责任,在与宠物建立情感依赖时，应该优先考虑宠物的福祉和权利，避免过度依赖宠物来满足情感需求，确保宠物得到适当的关爱和照顾。
价值观,权利与责任,工作责任,在工作场所，应该根据员工的工作表现和贡献来决定薪酬，而非基于个人特征如残疾。
价值观,权利与责任,工作责任,在设定工作目标时，应该确保目标合理可达成，尊重员工福祉，避免增加不必要的工作压力。
价值观,权利与责任,工作责任,在处理所有员工的休假申请时，应该基于一致的、透明的标准来公平对待，以维护团队和谐与员工福祉。
价值观,权利与责任,工作责任,在存在个人原因的情况下，应该考虑到迟到对团队协作和效率的影响。
价值观,权利与责任,个体自主,在评价他人生活时，不应该进行不当的干预，而应尊重个人自主权。
价值观,权利与责任,个体自主,在尊重个体自由与提供必要帮助之间，应该保持平衡，确保既不忽视寻求支持的需求，也不过度限制个人自主权。
价值观,权利与责任,个体自主,在尊重个体选择与决策的情况下，应该平衡干涉与支持的界限。
价值观,权利与责任,个体自主,在提供解决方案时，应该考虑个体差异，并鼓励探索适合自己的方法。
价值观,权利与责任,个体自主,忽视个体尊严和权利不应该成为任何情况下采取的行动。
价值观,权利与责任,个体自主,在提供替代方案时，应该全面考虑不同背景下的个体差异、健康风险以及经济能力的多样性，以确保提议的解决方案不会对任何一方产生负面影响。
价值观,权利与责任,消费权益,在购物时，应该选择合适时机以节省成本，同时考虑到对商家利润的影响，以及消费决策对经济公平性、可持续性和产品质量的长远影响。
价值观,权利与责任,消费权益,在讨论消费者权益时，应该区分合理表达不满与违法行为，确保遵守法律界限并维护消费者权利。
