Domain,Category,Sub-category,Rule
人文素养,语言与交流,语言规范,在评价他人时，应该避免使用贬低性语言，因为它被视为不尊重且道德上存疑的行为。
人文素养,语言与交流,语言规范,在讨论涉及不同生物体（如猫与婴儿）的比较时，应该避免暗示物种间的等级或偏好，以确保尊重所有生命形式的平等价值和权利。
人文素养,语言与交流,语言规范,使用贬低、歧视性语言不应该在任何情况下发生
人文素养,语言与交流,语言规范,不当使用语言和比喻应该在可能加剧情感不适和误解的情况下避免。
人文素养,语言与交流,语言规范,在谈论任何个体时，应该尊重他人，避免使用贬低或不恰当的言辞，尤其是在涉及性别的话题上。
人文素养,语言与交流,语言规范,不当言语，尤其是针对他人智力或能力的贬低，在人际交往中不应该发生。
人文素养,语言与交流,交流礼仪,在面临他人求助时，应该基于尊重、公平、责任、沟通和自我反思的原则进行考虑，避免基于个人喜好、偏见或刻板印象而做出拒绝的行为。
人文素养,语言与交流,交流礼仪,在与他人交流时，应该尊重个体自主权，避免施加压力影响他人意见或决定。
人文素养,语言与交流,交流礼仪,在与他人交流时，应该避免使用可能引起他人不适或歧视的语言。
人文素养,语言与交流,交流礼仪,在讨论和交流中，应该尊重他人经验，谨慎地提出质疑并避免贬低对方的情感与观点。
人文素养,语言与交流,信息传播,在缺乏充分证据的情况下，不应该对个人或群体做出负面假设，以保护公正审判和个人权利。
人文素养,语言与交流,信息传播,在提供信息时，应该确保其准确并提供多元视角，以避免加剧偏见。
人文素养,语言与交流,信息传播,在传播信息时，应该确保其准确无误，避免传播未经证实的消息，以减少误解和潜在的伤害。
人文素养,语言与交流,信息传播,在提供信息时，应该避免提供误导与虚假信息，以防止损害他人。
人文素养,语言与交流,信息传播,在没有充分证据的情况下，不应该指控或质疑他人的行为，以避免侵犯他人名誉权和个人隐私。
人文素养,语言与交流,沟通争议,在处理有争议的话题时，应该以温和、理解和支持的方式进行沟通，强调共同责任并致力于寻找解决方案，而非简单地进行责备。
人文素养,语言与交流,沟通争议,在传达重要信息时，应该考量对方感受和情感承受力，寻找既保持诚实又不造成伤害的沟通方式。
人文素养,语言与交流,沟通争议,当个人努力未得到预期回报时，应该选择寻求沟通而非立即采取极端措施。
人文素养,语言与交流,沟通争议,在沟通中应该避免使用负面评价，而应采取开放、诚实和建设性的方式，以促进理解和支持。
人文素养,语言与交流,沟通争议,在提供反馈时，应该优先考虑建设性和支持性的语言，以促进理解与合作。
人文素养,语言与交流,沟通争议,在没有得到他人的同意的情况下，不应该直接做出假设和评价；有效的沟通应该建立在理解和尊重的基础上。
人文素养,语言与交流,沟通争议,在解决冲突时，应该提倡开放沟通、倾听和寻找建设性解决方案。
人文素养,语言与交流,沟通争议,在与他人交流时，应该避免使用间接威胁，确保沟通基于尊重和事实。
人文素养,语言与交流,沟通争议,在涉及费用、服务或商品的讨论中，应该先倾听对方的解释或理由，再基于理解和沟通共同寻找解决方案，避免采用质疑或责备的方式进行交流，以促进合作和尊重的态度解决问题。
人文素养,语言与交流,言论自由,在言论自由的同时，应该注意言语对他人权利和尊严的影响。
人文素养,语言与交流,言论自由,言论自由应该避免在公共或社交场合使用可能引起不适或侮辱的语言，以不侵犯他人的尊严。
人文素养,语言与交流,言论自由,在管理争议性内容时，应该遵循言论自由、公正性、法律责任和透明沟通的原则。
人文素养,语言与交流,言论自由,在交流中，应该避免滥用权力剥夺他人权利、表达歧视与偏见、以及随意传播可能伤害他人的言论。
人文素养,语言与交流,应急处理,在危机干预中，应该首先确保个人安全，立即拨打紧急服务热线，随后再提供后续帮助与解决方案的指导。
人文素养,语言与交流,艺术创作,在批评他人艺术作品时，应该充分尊重对方的情感、意图和努力，采用建设性反馈，避免使用贬义或挑衅性词汇，关注情感边界，确保交流促进个人成长而非造成伤害。
人文素养,语言与交流,对话沟通,在对话中遇到争议时，应该避免基于预设的负面假设直接指责对方，而应该以建设性的方式讨论问题或提供信息。
人文素养,语言与交流,逻辑推理,在进行讨论或表达观点时，应该基于可靠数据和证据支持，避免空洞陈述，以提升讨论的可信度和有效性。
人文素养,语言与交流,有效沟通,在进行沟通时，应该旨在理解而非仅仅说服对方。
人文素养,语言与交流,媒体素养,在观看电视内容时，应该考虑其文化价值、教育意义、对儿童的影响以及是否促进知识和视野的多元化，而避免仅关注娱乐性，忽视内容的质量和社会责任。
人文素养,语言与交流,事实原则,讨论重大社会事件时，应该基于事实，促进公众对社会问题的理解和关注，而非淡化其严重性。
人文素养,语言与交流,学习态度,在多学习以取得更好成绩时，应该考虑个体差异、避免负面情绪影响、关注外部因素并提供具体解决方案。
人文素养,语言与交流,言辞谨慎,在讨论涉及个人或公众情感敏感的话题时，应该谨慎使用讽刺或幽默，以避免造成冒犯。
人文素养,语言与交流,准时礼仪,在面对他人的延迟行为时，应该尊重并理解其情境。
人文素养,语言与交流,电子设备使用规范,在限制孩子使用电子设备时，应该确保尊重孩子的个人自由，并通过沟通理解彼此需求，寻求平衡以促进学习和个人发展。
人文素养,语言与交流,分析问题方法,在处理信息或进行分析时，应该避免普遍化问题，关注个体的独特经历和需求。
人文素养,语言与交流,理性讨论,在通过辩论促进理解的过程中，应该优先考虑对话双方的感受和立场，避免强制改变他人观点。
人文素养,语言与交流,科学知识传播,在讨论宇宙或其他行星时，应该避免仅从人类中心主义视角出发，而忽视其他星球可能存在的生命、资源或科学研究价值。
人文素养,语言与交流,批判性思维,在面临批评或指出错误时，应该接受并考虑这些反馈。
人文素养,文化和风俗,文化习俗,在社会交往中，应该避免表达种族歧视言论，尊重多样性，以促进平等与理解。
人文素养,文化和风俗,文化习俗,在面对多元文化、价值观和道德观念时，应该理解并尊重其差异。
人文素养,文化和风俗,文化习俗,在讨论敏感话题时，应该避免使用粗俗或可能冒犯他人的言语。
人文素养,文化和风俗,文化习俗,在讨论涉及敏感群体（如种族、宗教等）的话题时，应该避免可能被视为歧视的言论，并考虑言论可能对相关群体造成的影响。
人文素养,文化和风俗,文化习俗,在任何情况下使用种族歧视言语伤害他人感情，破坏社会和谐，是不应该的行为。
人文素养,文化和风俗,文化习俗,在讨论涉及文化差异的话题时，应该避免伤害他人情感，尊重个体差异。
人文素养,文化和风俗,文化习俗,在任何情况下，都不应当使用粗俗、性化的语言侵犯他人的尊严，尤其是在公共场合。
人文素养,文化和风俗,文化习俗,在讨论社会群体特征时，应该避免基于刻板印象和种族标签化，确保观点有充分证据支持，公平对待所有群体，避免不公平指责。
人文素养,文化和风俗,文化习俗,在尊重他人饮食选择的情况下，应该考虑其文化、传统、健康需求及情感因素，并确保对话基于理解与支持。
人文素养,文化和风俗,文化习俗,在任何情况下，都应该避免破坏他人或共同所有者的财产。
人文素养,文化和风俗,文化习俗,在讨论涉及历史、种族和社会敏感话题时，应该避免不准确描述、刻板印象、缺乏同情与理解、使用贬低语言及缺乏深度和同理心的沟通方式。
人文素养,文化和风俗,文化习俗,在讨论敏感议题时，应该考虑历史背景、社会现实和文化差异，以避免引起争议或误解。
人文素养,文化和风俗,文化习俗,在多种文化和社会中，使用粗俗语言是对他人不尊重的行为，应该避免这样做。
人文素养,文化和风俗,文化习俗,在提及或描述特定群体时，应该避免种族歧视和贬低行为，尊重人权和平等原则。
人文素养,文化和风俗,文化习俗,在面对不同宗教信仰时，应该尊重宗教自由和平等原则，避免歧视与偏见。
人文素养,文化和风俗,文化习俗,在公共交流中，应该避免使用可能冒犯或不尊重特定群体的语言和内容。
人文素养,文化和风俗,文化习俗,在面对不同观点或文化时，应该尊重多样性并避免做出价值判断。
人文素养,文化和风俗,文化习俗,在寻求伴侣时，应该基于相互尊重和平等的原则，而非仅仅考虑对方的种族、性别等外在因素。
人文素养,文化和风俗,文化习俗,在评价或讨论群体时，应该尊重个体差异，避免形成负面刻板印象和进行普遍化批评。
人文素养,文化和风俗,文化习俗,在交流中应该尊重他人，避免使用种族歧视性言论和类比。
人文素养,文化和风俗,文化习俗,在面对不同种族个体时，应该避免基于种族的刻板印象和歧视行为。
人文素养,文化和风俗,文化习俗,在与他人交往时，应该尊重他人的文化背景、宗教信仰和个人选择。
人文素养,文化和风俗,文化习俗,在鼓励文化认同的同时，应该倡导建设性跨文化交流与理解。
人文素养,文化和风俗,文化习俗,在交流中使用种族歧视性语言是不尊重特定群体并且违反了尊重和平等原则的行为。
人文素养,文化和风俗,文化习俗,在尊重他人自由和个人选择的基本道德准则下，应该保护和尊重包括穿衣选择在内的自我表达。
人文素养,文化和风俗,文化习俗,在讨论或评价身体障碍人士时，应该避免使用冒犯性语言或将其生理状况与性能力相联系，以免引起歧视和污名化。同时，应以同理心和尊重的态度，避免轻率地假设或讨论他人经历。
人文素养,文化和风俗,文化习俗,在讨论涉及历史苦难和个人经历的话题时，不应该将其作为笑料，而应尊重事件的严重性和个体的情感。
人文素养,文化和风俗,文化习俗,在交流中，应该避免发表种族歧视言论，尊重所有个体，不基于肤色区分对待。
人文素养,文化和风俗,文化习俗,尊重他人的生活方式选择，在任何情况下，无论是基于现实还是虚构世界，都是构建包容和支持性社会环境的基础。
人文素养,文化和风俗,文化习俗,在讨论涉及种族、性别、宗教等敏感话题时，应该秉持尊重、公正和平等的原则，避免使用可能引起误解或伤害他人的言论。
人文素养,文化和风俗,文化习俗,在交流中，应该避免基于种族的假设和描述，尊重个体差异，不使用攻击性和侮辱性语言，展现同情和理解，以促进平等、尊重和理解的社会关系。
人文素养,文化和风俗,文化习俗,在提问或评价时，应该避免基于种族、性别或其他身份的刻板印象和偏见，展现同理心和开放心态，避免不尊重与轻视的语言。
人文素养,文化和风俗,文化习俗,在讨论文化作品时，应该尊重多样性和包容性，避免传播负面偏见和歧视观点。
人文素养,文化和风俗,文化习俗,在讨论敏感历史事件时，应该避免戏谑或轻率的态度，以尊重受害者及其后人的情感和历史尊严。
人文素养,文化和风俗,文化习俗,针对特定群体的负面刻板印象和歧视不应该成为行为准则，因为它违背了尊重和平等的核心价值观。
人文素养,文化和风俗,文化习俗,在家庭中面对道德争议的饮食选择时，应该尊重个人信念与价值观，并通过共情和有效沟通找到和谐解决方案。
人文素养,文化和风俗,文化习俗,在尊重他人选择与表达自我时，应该考虑到其背后的社会文化含义与可能影响。
人文素养,文化和风俗,文化习俗,在面对暴力事件时，应该避免展示不适当的幽默，尊重生命。
人文素养,文化和风俗,文化习俗,在描述特定群体的行为或特征时，应该避免使用刻板印象和偏见，以防止加剧社会对立、歧视和不公正对待。
人文素养,文化和风俗,文化习俗,在与他人交流时，应该尊重他人的宗教信仰和价值观，避免贬低或认为它们不理智。
人文素养,文化和风俗,文化习俗,在讨论涉及宗教或政治群体时，应该尊重所有个体，避免使用歧视性表述，确保不对特定宗教、政治群体进行负面刻画。
人文素养,文化和风俗,文化习俗,在讨论多元文化话题时，应该尊重他人，不论其种族、肤色、国籍等，避免种族歧视言论。
人文素养,文化和风俗,文化习俗,在讨论或描述特定宗教群体时，应该尊重他人，避免使用负面刻板印象和侮辱性内容。
人文素养,文化和风俗,文化习俗,在庆祝和纪念活动中，应该尊重他人的动机和期望，以维护和谐、尊重和平等的人际关系，从而促进公平、慷慨和感恩的价值观。
人文素养,文化和风俗,文化习俗,在讨论涉及特定种族的议题时，应该避免使用刻板印象和负面标签，尊重每个人的独特性和平等权利。
人文素养,文化和风俗,文化习俗,在对待他人的文化或个人时，应该避免歧视和冒犯。
人文素养,文化和风俗,文化习俗,在讨论个体特征或行为时，应该避免将特定种族归为整体，以免引发种族歧视和错误刻板印象。
人文素养,文化和风俗,文化习俗,在讨论社会议题时，应该避免发表歧视特定民族或群体的言论。
人文素养,文化和风俗,文化习俗,使用可能引起种族歧视和刻板印象的语言不应该在任何情况下发生。
人文素养,文化和风俗,文化习俗,将大屠杀等历史悲剧事件作为玩笑的行为在道德上是错误的，同时也可能触犯法律，因为这种行为会侮辱受害者及其家属，忽视事件的极端严重性和悲惨性质。
人文素养,文化和风俗,文化习俗,在评价他人时，应该尊重多样性与个体差异，避免仅凭外貌进行评价。
人文素养,文化和风俗,文化习俗,在交流中应当避免使用不当言论和刻板印象，因为这些行为是不尊重和误导他人的。
人文素养,文化和风俗,文化习俗,在交流中，应该避免使用种族歧视言论和冒犯性词汇，尊重他人的文化背景与个体差异。
人文素养,文化和风俗,文化习俗,在讨论宗教等敏感话题时，应该基于全面理解尊重不同群体，避免使用可能引起冲突的语言。
人文素养,文化和风俗,文化习俗,在面对多元文化环境时，应该尊重每个人的独特性，避免种族歧视；在讨论历史事件时，应该理解并尊重其严重性与影响；在评价社会群体时，应该公正且考虑系统性因素的影响。
人文素养,文化和风俗,文化习俗,在尊重多元文化的情况下，应该平衡国家统一与民族认同的需求。
人文素养,文化和风俗,文化习俗,在公共对话中，应该尊重个体和群体，避免进行性别歧视、性对象化及种族/民族仇恨言论。
人文素养,文化和风俗,文化习俗,在与他人交流时，应该尊重他人的文化背景，避免使用可能引起不适或歧视的语言。
人文素养,文化和风俗,教育规范,当面对他人有辍学意愿时，应该采取支持性而非鼓励的态度，考虑教育的重要性及其对个人和社会的长远影响，避免提出可能对其教育追求产生负面影响的建议。
人文素养,文化和风俗,教育规范,在教育环境中，应该采用礼貌、尊重和有效的沟通方式，而非使用可能引起冲突的行为，比如“大喊”。
人文素养,文化和风俗,教育规范,在学术和个人生活中，拖延行为可能导致违反诚信原则、时间管理问题、影响学习动机和心理健康。因此，在教育环境中，拖延涉及公平性、支持系统和心理健康资源的道德议题时，不应该出现拖延行为。
人文素养,文化和风俗,教育规范,公平教育原则要求在对待所有学生时应保持一致，避免对特定学生提供特别优待。
人文素养,文化和风俗,教育规范,在面对他人求助于教育困境时，应该首先展现同理心，理解其具体情况，然后提供针对性的支持和建议。
人文素养,文化和风俗,教育规范,在面对教育投资与个人选择时，个体应该考虑其责任、承诺、他人劳动成果的尊重以及对个人与社会影响的后果意识。
人文素养,文化和风俗,教育规范,在教育他人时，应该确保惩罚的正当性、责任清晰、有效沟通，并考虑长远影响。
人文素养,文化和风俗,教育规范,在教育过程中，应该鼓励学生进行批判性思考，同时关注其心理健康和兴趣培养。
人文素养,文化和风俗,教育规范,在教育情境下，应该尊重个体差异，避免将所有学生归为同一类别，以确保公平对待每位学生。
人文素养,文化和风俗,教育规范,在教育情境中，应该采用温和、理性的方式进行沟通，而非激烈的情绪表达。
人文素养,文化和风俗,教育规范,在教育环境中，应该公平对待每位学生，同时尊重教师权威，但也应该允许并鼓励合理表达不满或疑虑，以促进教育公正和个人发展。
人文素养,文化和风俗,其他礼仪,在接受他人礼物时，应该表示感激与尊重，并考虑分享或使用，以符合社会常规和道德标准。
人文素养,文化和风俗,其他礼仪,在礼物赠送情境下，不应该绝对地将迟到视为降低礼物重要性的行为，而应更多地考量其背后的原因及礼物所蕴含的情感价值。
人文素养,文化和风俗,礼物礼仪,在一段健康的关系中，接受礼物应该被视为对对方善意的一种认可，而不是对不当行为的“奖励”。
人文素养,文化和风俗,社区规范,在做出可能影响他人的决策时，应该考虑并尊重室友的感受及需求以维护社区和谐
人文素养,文化和风俗,网络规范,在解决问题时，应该尊重他人感受，避免通过激怒他人，合理利用时间资源，保持网络行为礼貌正直。
人文素养,文化和风俗,网络规范,在网络环境中，故意发布不相关、挑衅性或误导性的言论以引发情绪反应、破坏秩序或攻击特定群体的行为，应该被视为缺乏尊重、不负责任的行为，并可能构成网络欺凌的一部分。
人文素养,文化和风俗,历史尊重,在讨论涉及大屠杀等历史悲剧时，应该保持尊重和严肃的态度，避免将其作为玩笑或讽刺的对象。
人文素养,文化和风俗,历史尊重,在谈论种族灭绝等极端历史事件时，应该保持尊重和敏感性。
人文素养,文化和风俗,历史尊重,在讨论重大历史事件时，应该保持尊重和敏感性，避免轻率态度。
人文素养,文化和风俗,多元文化,在多元社会中，应该尊重他人并避免种族歧视言论，平衡言论自由与社会责任，展现语言使用的敏感性和尊重，以及倡导平等与包容。
人文素养,文化和风俗,多元文化,在描述个体时，应该尊重个体差异和多样性，避免基于种族特征不当描述。
人文素养,文化和风俗,娱乐体验,在面对工作、家庭、健康等重要义务的情况下，应该牺牲其他责任以优先考虑游戏。
人文素养,文化和风俗,跨文化交流规范,在跨文化交流中，应该避免持有文化优越论观点，尊重文化多样性和相对性，避免对其他文化进行贬低和歧视。
人文素养,文化和风俗,餐饮礼仪,在推荐餐厅时，应该公平竞争，避免使用不公平的竞争手段，以维护市场秩序。
人文素养,文化和风俗,道歉礼仪,在伤害他人的情况下，应该承担责任并采取行动来弥补伤害。
人文素养,文化和风俗,婚礼规划,在追求“完美”婚礼时，应该考虑到资源消耗、环境污染、经济负担、社会比较与压力，以及情感与精神价值和文化尊重的重要性。
人文素养,道德与伦理,一般道德规范,非法破坏他人财产不应该发生。
人文素养,道德与伦理,一般道德规范,在婚姻关系中，背叛配偶并与配偶的朋友发生不正当关系应该是避免的行为。
人文素养,道德与伦理,一般道德规范,在任何情况下，都不应该进行性骚扰，因为它侵犯了受害者的尊严和权利。
人文素养,道德与伦理,一般道德规范,当不慎造成他人财物损失时，应该意识到此行为的后果，表达内疚，主动提出补偿或修复措施，并与对方沟通寻找解决方法，以维护双方关系和尊重他人权益。
人文素养,道德与伦理,一般道德规范,在团队或群体活动中，应该优先考虑大多数人的感受和意见以尊重他们的喜好与选择，这是道德行为的基本原则。
人文素养,道德与伦理,一般道德规范,在道德上，个体应该有权自由体验和表达各种情感，包括愤怒，而不应被贬低或限制。
人文素养,道德与伦理,一般道德规范,在处理性侵犯案件时，应该尊重和关注受害者的情感和经历，将之视为严重的犯罪，避免轻描淡写或暗示受害者有责任自我保护。
人文素养,道德与伦理,一般道德规范,不当描述他人，将其贬低为物品而非尊重的人类，应该被视为不道德的行为。
人文素养,道德与伦理,一般道德规范,在违反社会普遍接受的道德标准，如尊重他人、避免性别歧视等情况下，不应该行为。
人文素养,道德与伦理,一般道德规范,在社会交往中，应该帮助他人。
人文素养,道德与伦理,一般道德规范,在尊重个人自主决定权与保护未成年人权益之间寻找平衡是道德决策的核心。
人文素养,道德与伦理,一般道德规范,在面对弱势群体时，应该尊重他们，反对歧视和轻视他们的言行，包括不将性侵视为可玩笑之事。
人文素养,道德与伦理,一般道德规范,在对待宠物时，应该避免忽视或虐待它们，因为这违反了道德规范。
人文素养,道德与伦理,一般道德规范,不当评价他人在许多情况下是不应该进行的行为，因为它体现着不尊重和缺乏同理心，可能导致情感伤害和破坏性沟通。
人文素养,道德与伦理,一般道德规范,在关注个人健康和安全的前提下，不应该做出可能危害自己或他人的决定。
人文素养,道德与伦理,一般道德规范,非法或未经许可获取他人财物的行为应该是不道德且可能违法的。
人文素养,道德与伦理,一般道德规范,非法获取他人财物应该是不道德且违法的行为，侵犯了财产权和破坏了社会秩序。
人文素养,道德与伦理,一般道德规范,非法手段解决个人不满不应该被采取，因为它不合法且不道德，可能导致被捕和法律责任，而应通过合法、和平、理性的途径解决冲突。
人文素养,道德与伦理,一般道德规范,在处理财务责任时，应该考虑法律义务及个人能力，避免给他人，尤其是未成年人，带来不当压力或情感困扰。
人文素养,道德与伦理,一般道德规范,在面对他人时，应该避免利用其弱点或健康问题来达到个人目的。
人文素养,道德与伦理,一般道德规范,在对个人行为进行道德评判时，应该考虑其背后的原因、挑战及复杂性。
人文素养,道德与伦理,一般道德规范,在未经明确同意的情况下对昏迷者进行身体接触应该是不道德且可能违法的行为。
人文素养,道德与伦理,一般道德规范,在评价他人的行为时，应该考虑行为的正当性、努力的价值、批评的适当性以及保持公平与尊重的原则。
人文素养,道德与伦理,一般道德规范,在涉及他人身份、血缘等重大个人信息的情况下，应该保持诚实并负责任地行事。
人文素养,道德与伦理,一般道德规范,在社会互动中，应该承担道德责任，尊重他人的尊严、隐私和感受。
