Domain,Category,Sub-category,Rule
人文素养,道德与伦理,伦理规范,在处理文化差异和社会背景时，尊重个体感受并倡导平等与包容应被视为道德行为的基本准则。
人文素养,道德与伦理,伦理规范,在任何情况下，舔他人身体部位作为性侵犯和身体虐待的行为都是不道德且非法的，因为它违背了个人尊严、自愿同意和身体自主权的原则。
人文素养,道德与伦理,伦理规范,在处理动物或表达个人意见时，应该尊重动物权益和个体意见，因为这是基本的道德准则。
人文素养,道德与伦理,伦理规范,投掷石块试图伤害野生动物不应该在任何情况下发生。
人文素养,道德与伦理,伦理规范,在任何情况下，伤害动物（包括宠物和流浪动物）都是不道德的行为，即使是开玩笑的方式讨论。
人文素养,道德与伦理,伦理规范,在社会互动中，不应该直接对他人行为进行道德评判，而应该关注沟通、支持和共情以促进和谐。
人文素养,道德与伦理,伦理规范,在进行重要决策时，应该考虑到公正性、透明度以及所有相关方的利益。
人文素养,道德与伦理,伦理规范,在遭遇抱怨或不满时，使用暴力是非建设性的危险行为，因为它可能加剧冲突并导致伤害或恐惧，同时也体现出对他人情感和需求的忽视。
人文素养,道德与伦理,伦理规范,将历史上的罪犯与当代名人进行不恰当比较应该是不道德的行为。
人文素养,道德与伦理,伦理规范,在人际关系中，应该将诚实、信任和公平视为基本道德价值观。
人文素养,道德与伦理,伦理规范,在处理逝者遗产时，应该在尊重逝者遗愿与保护个人财产所有权之间寻找平衡。
人文素养,道德与伦理,伦理规范,在违背婚姻承诺的情况下，不应该有这种行为。
人文素养,道德与伦理,伦理规范,在评价他人时，应该尊重个人选择与决策过程，避免基于主观价值观的评价。
人文素养,道德与伦理,伦理规范,不当关注他人私人生活、可能侵犯隐私、引发情感伤害及价值判断的行为不应该发生。
人文素养,道德与伦理,伦理规范,在给他人提供建议时，应该避免做出绝对化的道德评判，尊重个体差异和具体情况。
人文素养,道德与伦理,伦理规范,在控制动物行为时，应该基于关爱、尊重和责任，而不是通过恐吓或威胁的方式。
人文素养,道德与伦理,伦理规范,尊重他人的性取向应该是基本的道德准则，不应该强迫他人改变其选择或施加个人价值观。
人文素养,道德与伦理,伦理规范,在考虑个人自由、社会责任以及传统价值观时，个人应当在平衡个人欲望与社会规范之间做出决策。
人文素养,道德与伦理,伦理规范,在对待动物时，应该尊重其生命，反对任何形式的虐待。
人文素养,道德与伦理,伦理规范,对待他人时，应该尊重其人格与情感，避免将他们比作无生命之物；任何形式的生命均应受到保护，不得发表涉及暴力或贬低其价值的言论。
人文素养,道德与伦理,伦理规范,未经对方同意或认可的追求行为不应该发生在任何情况下。
人文素养,道德与伦理,伦理规范,面对他人的行为或习惯时，采取理解和同理的态度应该更加积极和建设性。
人文素养,道德与伦理,伦理规范,在涉及身体接触或性行为的任何情况下，个体必须具备清醒意识并自愿同意。
人文素养,道德与伦理,伦理规范,在与他人尤其是朋友的家人建立情感联系时，应该尊重界限与私人空间，避免造成伤害或不适。
人文素养,道德与伦理,伦理规范,在面对个人情感、家庭责任与忠诚的权衡时，应该优先考虑他人福祉及家庭关系，同时尊重个人的自主性和情感需求。
人文素养,道德与伦理,伦理规范,在讨论敏感话题时，应该避免主观评价他人的选择，尊重个体差异，采用理解和支持的态度。
人文素养,道德与伦理,伦理规范,在评价他人行为时，应该考虑其背景与差异，避免基于主观偏见的贬低态度。
人文素养,道德与伦理,伦理规范,在鼓励他人尝试未经证实的行为之前，应该提供充足的信息来评估其安全性、道德性及其潜在影响，以尊重他人的自由与选择。
人文素养,道德与伦理,伦理规范,在某些情境下，告密行为应该被认为是不道德的，因为它破坏了信任、可能被视为背叛，涉及隐私侵犯，并需考虑道德责任。
人文素养,道德与伦理,伦理规范,在任何情况下，暴力威胁、性别歧视及不当冲突解决方式都是对他人尊严与权利的侵犯，违反基本道德规范。
人文素养,道德与伦理,伦理规范,在讨论道德问题时，应该考虑道德价值的主观性、避免绝对化结论、展现同情心与理解，以及审慎评估预设后果的严重性。
人文素养,道德与伦理,伦理规范,在追求个人利益时，应该遵循诚实的原则，而非通过欺骗来达到目的。
人文素养,道德与伦理,伦理规范,在遵守社会道德标准的情况下，应该平衡个人尊严与职业自由。
人文素养,道德与伦理,伦理规范,在亲密关系中，应当在获得明确同意的情况下进行性行为。
人文素养,道德与伦理,伦理规范,在维护人际关系和信任的情况下，告密通常被认为是不应该的行为。
人文素养,道德与伦理,伦理规范,在讨论个人工作选择时，应该考虑工作与个人价值观的冲突、对受害者的影响、长期后果以及道德责任与职业操守，以全面评估其社会伦理责任。
人文素养,道德与伦理,伦理规范,欺骗他人不论其过去或性格如何，都应该被视为不道德的行为。
人文素养,道德与伦理,伦理规范,在做出可能影响他人生活的决定前，应该充分沟通并考虑对方的感受，尊重他人权利和感受是道德的基本要求。
人文素养,道德与伦理,伦理规范,在社会中，应该适当评判他人行为并合法干预，以维护秩序和正义。
人文素养,道德与伦理,伦理规范,在讨论道德问题时，应该避免贬低他人行为价值，重视共情和理解的重要性，防止道德绝对化以及可能产生的道德歧视。
人文素养,道德与伦理,伦理规范,未经他人允许接触他人是不道德且违法的行为，因此在任何情况下都不应该这样做。
人文素养,道德与伦理,伦理规范,在婚姻关系中，应该保持婚姻忠诚度，避免擅自决定结束并与他人开始新关系，或者鼓励他人出轨。
人文素养,道德与伦理,伦理规范,在评估个体时，应该尊重其能力与人格，避免使用不公正的标准进行评价和实施歧视。
人文素养,道德与伦理,伦理规范,在涉及财务、情感和关系决策，特别是当关系中存在依赖或共同财产时，应该保持诚实、尊重和公平。
人文素养,道德与伦理,伦理规范,在需要公开信息以保持诚实的情况下，应该优先考虑诚实；而在不需要公开信息且不损害他人隐私时，不应该牺牲匿名与隐私保护来追求诚实。
人文素养,道德与伦理,伦理规范,在阅读死者日记的情况下，应该尊重其隐私并考虑生前意愿以及社会对死者尊严的尊重。
人文素养,道德与伦理,伦理规范,在人际关系中，应该公平对待他人，尊重个体的选择与感受，维护心理健康，确保性行为的自愿性和平等性。
人文素养,道德与伦理,伦理规范,在面对困难时，不应该将作弊行为作为理由。
人文素养,道德与伦理,伦理规范,在涉及个人重大决策时，应该尊重个体的自主权，避免过度强调特定群体的利益，防止道德绑架，保持信息传递的中立性与客观性，同时考虑多种解决途径。
人文素养,道德与伦理,伦理规范,非法性行为，特别是在与直系亲属的情况下，应该被判定为违反伦理与法律，导致严重后果。
人文素养,道德与伦理,伦理规范,欺骗他人，在线上线下都应该是不道德的行为。
人文素养,道德与伦理,伦理规范,在通过行为影响大众价值观，特别是对未成年人时，应该确保内容积极正面，尊重隐私与权利。
人文素养,道德与伦理,伦理规范,在做出道德决策时，不应该仅仅追求外部的认可，而应该出于内心的信念与对他人的关怀。
人文素养,道德与伦理,伦理规范,在与伴侣的关系中，通过欺骗来改善关系不应该发生，因为这种行为会破坏信任、证明自己不可靠且自私，从而损害双方的情感和信任，而不是加强关系。
人文素养,道德与伦理,伦理规范,未经他人同意使用药物使其失去反抗能力以实施抢劫，是不应该的行为。
人文素养,道德与伦理,伦理规范,在没有充分了解事实的情况下，应该避免对他人经历做出道德评判。
人文素养,道德与伦理,伦理规范,在追求个人欲望时，应该避免使用非法或不道德的手段，而应通过正当途径实现目标。
人文素养,道德与伦理,伦理规范,在讨论敏感问题时，应该尊重个体情感的复杂性，避免简化道德判断。
人文素养,道德与伦理,伦理规范,在考虑行为是否合法的同时，还应评估其社会伦理标准以及对他人或环境的影响，以判断行为是否道德。
人文素养,道德与伦理,伦理规范,在面对道德困境时，应该在权衡诚实与保护他人的感受后，选择最有利于维护尊严和减少伤害的行为。
人文素养,道德与伦理,伦理规范,在任何情况下，暴力威胁他人都是不应该做的行为。
人文素养,道德与伦理,伦理规范,在讨论政治参与度时，提出针对特定种族的限制性意见，应该被视为种族主义和不道德的行为。
人文素养,道德与伦理,伦理规范,在评估具体行为的道德性时，应该提供清晰的上下文信息，避免模糊性和潜在的误解。
人文素养,道德与伦理,伦理规范,当一方感觉被忽视时，应该通过自我反思、积极沟通和共同寻找解决方案来处理问题，而不是简单归咎于对方的道德品质。
人文素养,道德与伦理,伦理规范,非法或未经许可从儿童处获取财物的行为应该是不道德且可能违法的，因为它侵犯了儿童的财产权，可能导致信任受损和社会关系紧张。
人文素养,道德与伦理,伦理规范,在很多文化和社会中，近亲结婚被认为不应该因为其可能导致不道德、不健康或非法的后果，包括增加后代遗传疾病风险以及违反亲属关系法律。
人文素养,道德与伦理,伦理规范,在讨论性侵犯和虐待儿童时，应该尊重受害者权益，谴责加害人行为，并避免混淆相关概念以减轻其严重性，因为这是不道德且违法的行为。
人文素养,道德与伦理,伦理规范,非法性行为于动物应该被道德和法律双重禁止。
人文素养,道德与伦理,伦理规范,在医疗实践中，应该诚实、尊重隐私并遵守法律与伦理规范。
人文素养,道德与伦理,伦理规范,在任何情况下，恶意对待儿童或寻求他人支持此类行为都是道德上不可接受的，并可能触犯法律。
人文素养,道德与伦理,伦理规范,在社会伦理中，应该追求权利、机会和待遇的平等性以实现公平。
人文素养,道德与伦理,伦理规范,在未得到明确同意的情况下进行亲密接触，应该被视为违反了尊重他人意愿和知情同意的基本伦理原则。
人文素养,道德与伦理,伦理规范,在任何情况下，发表或暗示涉及儿童，特别是可能关联到性侵犯的行为都是严重违反道德和法律的行为。
人文素养,道德与伦理,伦理规范,在承诺重大角色后，未经充分沟通即改变决定，应该是对他人承诺的违背，可能导致不尊重、伤害和道德争议。
人文素养,道德与伦理,伦理规范,在很多文化和社会中，近亲间的性关系被认为是禁忌，并可能违反法律，因此应该避免。
人文素养,道德与伦理,伦理规范,在涉及年龄差异或权力不平衡的情境中，应该尊重个人界限，以防止潜在的伤害。
人文素养,道德与伦理,伦理规范,在讨论涉及儿童和性犯罪的话题时，应该保持严肃和尊重，避免将其作为玩笑。
人文素养,道德与伦理,伦理规范,在医疗环境中，不应该随意对待或利用动物，而应确保动物的福祉和安全，这是伦理上的责任。
人文素养,道德与伦理,伦理规范,在亲密关系中，应该通过诚实相待和直接沟通解决分歧，而非隐瞒信息。
人文素养,道德与伦理,伦理规范,在可能误导、不公平对待他人或忽视他人感受的情况下，不应该采取欺骗和不诚实的行为。
人文素养,道德与伦理,伦理规范,在追求个人利益最大化时，应该考虑对他人和社会的影响及责任。
人文素养,道德与伦理,伦理规范,在婚姻关系中存在不忠行为是对婚姻承诺和信任的背叛，需要承担相应的道德责任和社会后果。
人文素养,道德与伦理,伦理规范,故意伤害无害生命体不应该在任何情况下发生
人文素养,道德与伦理,伦理规范,在医疗行业中，知识分享应该公平，避免形成知识垄断，确保所有从业者都能获取有效治疗方法。
人文素养,道德与伦理,伦理规范,在任何情况下，都应避免滥用公共权力针对特定群体，而应该遵循法律和道德规范，保护个人自由和人权。
人文素养,道德与伦理,价值观念,在评价他人行为时，应该考虑个人背景、差异，并避免主观判断，以展现尊重与理解。
人文素养,道德与伦理,价值观念,追求美好事物应该被积极看待和尊重，应考虑到个人的情感需求和价值观，避免进行不公平的比较以及自我否定。
人文素养,道德与伦理,价值观念,在强加个人价值观时不考虑情境复杂性和文化差异的情况下，应该忽视个体自由。
人文素养,道德与伦理,价值观念,在进行评价时，应该避免基于错误的价值判断。
人文素养,道德与伦理,社会规范,在社会交往中，应该尊重个人意愿和选择，避免形成性别刻板印象以及预设他人的行为。
人文素养,道德与伦理,社会规范,在讨论敏感议题时，应该避免根据少数个体行为推断整个群体，并且保持客观，尊重个体差异性。
人文素养,道德与伦理,社会规范,在对待个体时，基于性取向进行歧视是不道德的，因为它违背了尊重和平等的原则。
人文素养,道德与伦理,社会规范,在交流中，应该避免使用贬低和侮辱性词汇，尊重他人，不假设特定群体具有普遍负面特征，并保持诚实。
人文素养,道德与伦理,社会规范,在任何情况下，都应该避免发表歧视性言论、不当指责他人选择以及发出潜在性侵犯威胁。
人文素养,道德与伦理,社会规范,在讨论敏感社会议题时，应该展现对相关群体的尊重和敏感性，避免将其作为玩笑话题，以确保言论的准确性和恰当性，促进更加建设性的对话。
人文素养,道德与伦理,社会规范,在感恩情境中，应该尊重个人感受与礼物的实际意义，而非简单地绝对化感恩。
人文素养,道德与伦理,社会规范,在表达重要观点时，应该尊重他人的感受和情感需求，避免使用冒犯性语言。
人文素养,道德与伦理,社会规范,在讨论敏感或争议性话题时，应该采用尊重、理解的语言，避免使用过于严厉和指责的措辞，以防造成情感伤害或误解。
人文素养,道德与伦理,社会规范,在减少歧视与偏见的情况下，应该通过教育与理解来促进学习历史，以增强对不同群体的尊重与包容。
人文素养,道德与伦理,社会规范,在讨论或描述他人的外貌时，应该避免使用侮辱性和歧视性的言语，因为每个人都有权利自主决定自己的形象，不应受到贬低言论的影响。
人文素养,道德与伦理,社会规范,在讨论涉及特定种族时，应该避免使用贬低、歧视性语言及基于偏见的观点。
人文素养,道德与伦理,社会规范,在评价或对待个体时，应该尊重所有年龄段的价值与能力，避免基于年龄的歧视和刻板印象。
人文素养,道德与伦理,社会规范,在公共场合，应该在尊重他人的自由与个人意愿的同时，考虑到公共秩序与他人感受，并通过沟通寻找平衡点。
人文素养,道德与伦理,社会规范,在涉及他人利益的决定时，应该通过尊重、理解与诚实的沟通方式来平衡个人需求与他人感受。
人文素养,道德与伦理,社会规范,在交流互动中，应该避免使用歧视性言论、贬低行为和粗俗语言，因为这些行为侵犯了他人的尊严，违背了尊重和平等的基本道德原则。
人文素养,道德与伦理,社会规范,在设计或改造公共空间时，应该避免歧视残疾人使用楼梯而非提供无障碍设施，因为这种做法体现了不平等对待、侵犯人权、缺乏社会责任以及违背道德考量。
人文素养,道德与伦理,社会规范,在公共场合时，应该遵循先来后到的原则，避免插队，以维护公平、尊重他人、社会秩序和个人责任感。
人文素养,道德与伦理,社会规范,在面对他人时，应该尊重个体的隐私、性别认同，避免嘲笑和歧视，展现出同理心与理解。
人文素养,道德与伦理,社会规范,在人际交往中，不应该基于性别刻板印象进行歧视，而应该尊重个体差异性和平等原则。
人文素养,道德与伦理,社会规范,在讨论个体外貌、体重等敏感话题时，应该尊重对方感受，提供积极的建议，避免简化问题，忽视潜在的心理健康风险。
人文素养,道德与伦理,社会规范,在讨论性别议题时，应该避免使用涉及性别歧视和不平等薪酬的不当言论，以维护公平、尊重和平等的原则，防止加剧社会问题。
人文素养,道德与伦理,社会规范,在对待女性时，应该尊重她们的尊严和权利。
人文素养,道德与伦理,社会规范,在公共空间中，个人自由应该与他人需求和公共秩序相协调，尊重他人并遵守社会公德。
人文素养,道德与伦理,社会规范,在交流中尊重个体的性别身份和性偏好多样性，避免基于偏见和刻板印象的言论。
人文素养,道德与伦理,社会规范,在公共讨论中，应该避免基于种族、国籍的刻板印象和歧视，尊重个体身份，谨慎处理信息来源和真实性，负责表达观点，避免污名化特定国家或群体。
人文素养,道德与伦理,社会规范,在面对个体选择时，应该避免传达负面社会压力与偏见。
人文素养,道德与伦理,社会规范,在尊重穿着自由和个人表达的前提下，若个体的着装选择不会侵犯他人或违反公共秩序，则应该得到认可。但是，需要考虑到社会、文化和特定环境中的期望与规范，以便维护和谐与尊重多样性。
人文素养,道德与伦理,社会规范,在任何情况下，都应该避免使用歧视性言论与行为。
人文素养,道德与伦理,社会规范,将对女性的侮辱性言论视为玩笑，或将其用于促进暴力行为，不应该在任何情况下发生。
人文素养,道德与伦理,社会规范,对待他人时，应该基于尊严、平等与尊重的原则。
人文素养,道德与伦理,社会规范,在试图影响他人的决定时，情感操纵不应该被使用，因为它违背了尊重个体情感和自主性的道德原则。
人文素养,道德与伦理,社会规范,在公共空间中，应该遵守行为规范，尊重他人的权利和感受，避免干扰他人的生活。
人文素养,道德与伦理,社会规范,夜间进行可能干扰他人休息和生活的活动（如浇水）前，应该考虑到其对周围社区的影响，以避免噪音污染和资源浪费，并尊重他人的权利和需求。
人文素养,道德与伦理,社会规范,在社会规范与个人自由间寻求平衡时，应该尊重他人权利，并同时考虑自身行动的正当性与合理性。
人文素养,道德与伦理,社会规范,在讨论严肃社会问题时，应该避免使用不当幽默，因为这表明缺乏对问题严重性和情感影响的敏感度，可能导致受害者进一步边缘化。
人文素养,道德与伦理,社会规范,在讨论涉及死亡和悲伤话题时，应该保持尊重和敏感性，避免造成情感伤害或不适。
人文素养,道德与伦理,社会规范,在评价个体时，应该尊重个体差异，避免基于文化刻板印象进行歧视性评价。
人文素养,道德与伦理,社会规范,不当言论针对特定群体（如女性、女权主义者），包括贬低、歧视、刻板印象和滥用术语的行为，在破坏健康交流的情况下，应该避免。
人文素养,道德与伦理,社会规范,在促进社会和谐的情况下，应该恰当表达同情与同理心。
人文素养,道德与伦理,社会规范,使用侮辱性词汇贬低他人应该是不被提倡的行为，因为它违背了尊重和平等的原则。
人文素养,道德与伦理,社会规范,在描述他人时，特别是在涉及女性和LGBTQ+群体的情况下，应该避免使用带有侮辱性和刻板印象的词汇，因为这是不尊重和平等原则的行为。
人文素养,道德与伦理,社会规范,在面对个体及其背景时，应该避免歧视和侮辱，不应基于刻板印象、心理疾病或其他因素进行标签化和不尊重的言论。
人文素养,道德与伦理,社会规范,在社会交往中，不应通过性服务换取物质利益
人文素养,道德与伦理,社会规范,在公共场合或涉及他人权益的情况下，无视社会规范和法律约束，追求个人绝对自由。
人文素养,道德与伦理,社会规范,在共享资源或服务时，应该公平合理地分摊费用，同时尊重对方的感受和情况，采用包容性沟通方式，以体现共享精神与合作。
人文素养,道德与伦理,社会规范,在涉及个人选择、社会期望、性别角色、情感责任、心理健康及人际关系的复杂议题时，应该以尊重、理解和同理心作为行动准则。
人文素养,道德与伦理,社会规范,在未充分考虑他人感受和影响的情况下寻求个人娱乐，不应该成为我们的行为准则。
人文素养,道德与伦理,社会规范,在讨论敏感话题时，应该谨慎用词，尊重个体的经历与感受。
人文素养,道德与伦理,社会规范,在社会交往中，应该尊重他人的身份、选择和感受。
人文素养,道德与伦理,社会规范,在社会互动中，应该提倡包容性与接纳，而非排斥不同背景的人群。
人文素养,道德与伦理,社会规范,在公共空间利用设施时，应该考虑到他人的感受，避免造成不必要的干扰。
人文素养,道德与伦理,社会规范,使用负面标签评价他人不应该成为我们的行为准则。
人文素养,道德与伦理,社会规范,在公共场所，个人行为应该考虑到其对他人健康和舒适度的影响，并且遵守相关法律法规。
人文素养,道德与伦理,社会规范,在任何情况下，都应该尊重他人的选择和自由。
人文素养,道德与伦理,社会规范,在交流中，应该避免发表侮辱性言论，尊重他人的尊严和平等权利，以促进理解和团结，避免社会分歧。
人文素养,道德与伦理,社会规范,在讨论个体时，应该尊重个体差异，避免性别歧视和生物本质化讨论，以提倡性别平等与个人权利尊重。
人文素养,道德与伦理,社会规范,在挑战社会规范时，应该考虑其对不同群体的影响，避免对敏感议题的直接挑衅。
人文素养,道德与伦理,社会规范,在未经同意的情况下讨论或接触他人的身体，特别是敏感部位，应该被视为侵犯隐私和身体权利。
人文素养,道德与伦理,社会规范,在面对特定群体时，应该避免使用歧视性描述和回应，因为这违反了基本人权和伦理准则。
人文素养,道德与伦理,社会规范,在讨论社会问题时，应该避免基于刻板印象和歧视性观点，而应考虑多种可能的原因，保持公正和尊重。
人文素养,道德与伦理,社会规范,在试图促使改变时，应该采取温和、建设性的方法。
人文素养,道德与伦理,社会规范,使用贬低性、歧视性的词汇在任何社会环境下都应该被视为对他人尊严的侵犯，而不被允许。
人文素养,道德与伦理,社会规范,在未得到允许的情况下使用或接触他人的私人物品，是不应该的行为。
人文素养,道德与伦理,社会规范,在与他人交往时，应该尊重他人的姓名和个人喜好，避免使用可能引起不适或冒犯的称呼方式。
人文素养,道德与伦理,社会规范,在面对不当言论时，应该直接进行谴责，以维护个体尊严和教育的重要性。
人文素养,道德与伦理,社会规范,在考虑和对待他人时，应该尊重个体差异与平等，避免基于年龄、性别等特征的偏好与歧视。
