image_id,question,answers
78,为什么这么多绿色蔬菜？,"['健康', '健康', '健康', '健康', '做沙拉', '做沙拉', '很多蔬菜都是绿色的', '许多蔬菜是绿色的', '沙拉', '沙拉']"
78,Why so many green vegetables?,"['healthy', 'healthy', 'healthy', 'healthy', 'make salad', 'make salad', 'lots of vegetables are green', 'lots of vegetables are green', 'salad', 'salad']"
79,这种天气现象常常会引起什么不愉快的情绪状态？,"['抑郁症', '抑郁症', '抑郁症', '抑郁症', '震惊', '休克', '惊吓', '惊吓', '恐惧', '恐惧']"
79,What unpleasant emotional state does this weather phenomenon often cause?,"['depression', 'depression', 'depression', 'depression', 'shock', 'shock', 'fright', 'fright', 'fear', 'fear']"
80,桌子上是什么类型的烤箱？,"['烤面包机', '烤面包机', '烤面包机', '烤面包机', '烤面包机', '烤面包机', '烤箱', '烤面包机烤箱', '地球', '几何']"
80,What kind of oven is on the table?,"['toaster', 'toaster', 'toaster', 'toaster', 'toaster', 'toaster', 'toaster oven', 'toaster oven', 'ge', 'ge']"
81,人们是如何使用这个的？,"['帆', '帆', '帆', '航行', '航行', '帆船运动', '帆船运动', '航行', '航行', '航行']"
81,How do people use this?,"['sail', 'sail', 'sail', 'sail', 'sailing', 'sailing', 'sailing', 'sailing', 'to sail', 'to sail']"
82,用来擦脸或吃这顿饭的小布是什么？,"['餐巾纸', '餐巾', '餐巾纸', '餐巾', '餐巾纸', '餐巾', '餐巾', '餐巾', '餐巾', '餐巾纸']"
82,What small cloth is used to wipe the face or eating this meal?,"['napkin', 'napkin', 'napkin', 'napkin', 'napkin', 'napkin', 'napkin', 'napkin', 'napkin', 'napkin']"
83,这辆卡车在运什么？,"['家具', '家具', '家具', '家具', '家具', '家具', '货物', '货物', '货物', '货物']"
83,What is this truck moving?,"['furniture', 'furniture', 'furniture', 'furniture', 'furniture', 'furniture', 'goods', 'goods', 'cargo', 'cargo']"
84,那个月亮处于哪个阶段？,"['一半', '一半', '一半', '一半', '一半', '一半', '半个月亮', '半月', '半月', '半月']"
84,Which phase is that moon in?,"['half', 'half', 'half', 'half', 'half', 'half', 'half moon', 'half moon', 'half moon', 'half moon']"
85,这张床的封面上清楚地展示了哪种动物？,"['鹿', '鹿', '鹿', '鹿', '鹿', '鹿', '麋鹿', '驼鹿', '驼鹿', '驼鹿']"
85,What kind of animal is clearly displayed on the cover of this bed?,"['deer', 'deer', 'deer', 'deer', 'deer', 'deer', 'elk', 'elk', 'moose', 'moose']"
86,什么是马术运动的一种类型？,"['马球', '马球', '马球', '马球', '赛车', '赛车', '赛车', '赛车', '骑行', '骑行']"
86,What is a type of horseback sport?,"['polo', 'polo', 'polo', 'polo', 'racing', 'racing', 'racing', 'racing', 'riding', 'riding']"
87,什么物品可以用来加热这件家具？,"['电热毯', '电热毯', '电热毯', '电热毯', '消隐器', '遮光器', '烘干机', '烘干机', '毯子', '毯子']"
87,What item might be used to warm this item of furniture?,"['electric blanket', 'electric blanket', 'electric blanket', 'electric blanket', 'blanker', 'blanker', 'clothes dryer', 'clothes dryer', 'blanket', 'blanket']"
88,什么填充了气球？,"['他', '他', '他', '他', '他', '他', '他', '他', '他', '他']"
88,What fills the balloons?,"['helium', 'helium', 'helium', 'helium', 'helium', 'helium', 'helium', 'helium', 'helium', 'helium']"
89,这件家具通常是用于公共场所还是私人使用？,"['公共的', '公共', '公共的', '公共的', '公共', '公共的', '公共的', '公共', '公共的', '公共的']"
89,Would this article of furniture typically be for public or private use?,"['public', 'public', 'public', 'public', 'public', 'public', 'public', 'public', 'public', 'public']"
90,这架飞机可以容纳多少乘客？,"['15', '15', '15', '15', '10', '10', '18', '18', '8', '8']"
90,How many passengers can this plane accomodate?,"['15', '15', '15', '15', '10', '10', '18', '18', '8', '8']"
91,是什么把那个人从椅子上撞下来的？,"['波', '波', '波浪', '波', '波浪', '波浪', '水', '水', '水', '水']"
91,What knocked the guy off his chair?,"['wave', 'wave', 'wave', 'wave', 'wave', 'wave', 'water', 'water', 'water', 'water']"
92,这辆卡车上的标志有什么用途？,"['身份识别', '识别', '身份证明', '身份识别', '广告', '广告', '广告', '广告', '赞助', '赞助']"
92,What is the purpose of the logos on this truck?,"['identification', 'identification', 'identification', 'identification', 'advertising', 'advertising', 'advertising', 'advertising', 'sponsorship', 'sponsorship']"
93,这些物品的用途是什么？,"['艺术', '艺术', '艺术', '艺术', '纪念碑', '纪念馆', '装饰', '装饰', '坟墓', '坟墓']"
93,What is the purpose of these objects?,"['art', 'art', 'art', 'art', 'memorial', 'memorial', 'decoration', 'decoration', 'graves', 'graves']"
94,这里发生了什么？,"['睡眠', '睡眠', '睡眠', '睡眠', '睡眠', '睡眠', '睡眠', '睡眠', '休息', '休息']"
94,What happens here?,"['sleep', 'sleep', 'sleep', 'sleep', 'sleep', 'sleep', 'sleep', 'sleep', 'resting', 'resting']"
95,这架飞机是为哪家公司飞行的？,"['一世界', '一个世界', '一个世界', '一个世界', '1世界', '1世界', '1世界', '1世界', '不确定', '不确定']"
95,What company is this plane flying for?,"['oneworld', 'oneworld', 'oneworld', 'oneworld', '1 world', '1 world', '1 world', '1 world', 'not sure', 'not sure']"
96,说出这张图片中展示的窗帘类型？,"['窗帘', '窗帘', '窗帘', '窗帘', '杆式口袋窗帘', '杆式口袋窗帘', '大的', '大的', '蕾丝', '蕾丝']"
96,Name the type of curtains shown in this picture?,"['drapes', 'drapes', 'drapes', 'drapes', 'rod pocket curtains', 'rod pocket curtains', 'big', 'big', 'lace', 'lace']"
97,披萨上的肉来自哪种动物？,"['猪', '猪', '猪', '猪', '猪', '猪', '猪', '猪', '猪', '猪']"
97,What animal does the meat on the pizza come from?,"['pig', 'pig', 'pig', 'pig', 'pig', 'pig', 'pig', 'pig', 'pig', 'pig']"
98,怎么打开这个？,"['关键', '键', '钥匙', '钥匙', '键', '关键', '点火', '点火', '带有关键字的', '带钥匙']"
98,How do you turn this on?,"['key', 'key', 'key', 'key', 'key', 'key', 'ignition', 'ignition', 'with key', 'with key']"
99,这种动物通常有多高？,"['20英尺', '20英尺', '20英尺', '20英尺', '12英尺', '12英尺', '15英尺', '15英尺', '13英尺', '13英尺']"
99,How tall is this animal usually?,"['20 feet', '20 feet', '20 feet', '20 feet', '12 ft', '12 ft', '15 feet', '15 feet', '13ft', '13ft']"
100,这道菜里有多少番茄酱？,"['2杯', '2杯', '2杯', '2杯', '半杯', '半杯', '1/4杯', '1/4杯', '2罐', '2罐']"
100,How much tomato sauce is in this dish?,"['2 cups', '2 cups', '2 cups', '2 cups', 'half cup', 'half cup', '1 4 cup', '1 4 cup', '2 cans', '2 cans']"
